filename,title,authors,doi,arxiv_id,keywords,summary,tps,model,platform
2601.10462v3_ChartComplete A Taxonomy-based Inclusive Chart Dat.pdf,ChartComplete: A Taxonomy-based Inclusive Chart Dataset,"Ahmad Mustapha, Charbel Toumieh, Mariette Awad",,2601.10462v3,"Chart, Dataset, Chart Taxonomy, Chart Classification","The ChartComplete dataset, based on a chart taxonomy, covers thirty different chart types to provide a more inclusive benchmark for evaluating multi-modal large language models in chart understanding.",15.12,Phi-4,AMD RX 6800 (Vulkan)
2601.10477v1_Urban Socio-Semantic Segmentation with Vision-Lang.pdf,URBANSOCIO-SEMANTICSEGMENTATION WITH VISION-LANGUAGEREASONING,"Yu Wang, Yi Wang, Rui Dai, Yujie Wang, Kaikui Liu, Xiangxiang Chu, Yansheng Li",,,"urban socio-semantic segmentation, vision-language reasoning, satellite imagery, social semantic entities, cross-modal recognition, multi-stage reasoning, reinforcement learning","This work achieves socio-semantic segmentation from satellite imagery using a vision-language reasoning framework, introducing the SocioSeg dataset and the SocioReasoner model, demonstrating gains over state-of-the-art models and strong zero-shot generalization.",17.57,Phi-4,AMD RX 6800 (Vulkan)
2601.10485v1_Panning for Gold Expanding Domain-Specific Knowled.pdf,Panning for Gold: Expanding Domain-Specific Knowledge Graphs with General Knowledge,"Runhao Zhao, Weixin Zeng, Wentao Zhang, Chong Chen, Zhengpin Li, Xiang Zhao, Lei Chen",,,"Domain-specific Knowledge Graph Fusion, Knowledge Graph Enrichment, General-to-domain Knowledge Transfer, Fact-as-Program","This paper introduces a new task, domain-specific knowledge graph fusion (DKGF), to enhance domain-specific knowledge graphs (DKGs) by integrating relevant facts from general knowledge graphs (GKGs), addressing challenges of domain relevance and knowledge granularity misalignment.",17.02,Phi-4,AMD RX 6800 (Vulkan)
2601.10496v1_Model See Model Do Exposure-Aware Evaluation of Bu.pdf,"Model See, Model Do? Exposure-Aware Evaluation of Bug-vs-Fix Preference in Code LLMs","Ali Al-Kaswan, Claudio Spiess, Prem Devanbu, Arie van Deursen, Maliheh Izadi",10.1145/nnnnnnn.nnnnnnn,,"Large Language Models, bugs, fixes, Memorisation","This paper introduces an exposure-aware evaluation framework to assess how prior exposure to buggy versus fixed code influences a model's preference, revealing that exposure can skew bug-fix evaluations and highlight the risk of LLMs propagating memorised errors.",16.98,Phi-4,AMD RX 6800 (Vulkan)
2601.10498v1_Projected Microbatch Accumulation yields reference.pdf,Projected Microbatch Accumulation yields reference-free proximal policy updates for reinforcement learning,Nilin Abrahamsen,,arXiv:2601.10498v1,"reinforcement learning, proximal policy updates, large language model fine-tuning, PROMA, PPO, GRPO","This note introduces Projected Microbatch Accumulation (PROMA), a proximal policy update method for large language model fine-tuning that accumulates policy gradients across microbatches by projecting out sequence-wise gradient components before microbatch aggregation.",15.45,Phi-4,AMD RX 6800 (Vulkan)
2601.10511v1_Scalable Algorithms for Approximate DNF Model Coun.pdf,Scalable Algorithms for Approximate DNF Model Counting,"Paul Burkhardt, David G. Harris, Kevin T. Schmitt",,arXiv:2601.10511v1,"DNF Model Counting, Monte Carlo, Probabilistic Inference, Network Reliability, Probabilistic Databases, Approximation Algorithms, PAC Learning, Neural Nets, Hashing","The paper develops a new Monte Carlo approach for approximate DNF model counting with an adaptive stopping rule and short-circuit formula evaluation, achieving better efficiency and scalability compared to previous methods.",18.33,Phi-4,AMD RX 6800 (Vulkan)
2601.10512v2_SatMap Revisiting Satellite Maps as Prior for Onli.pdf,SatMap: Revisiting Satellite Maps as Prior for Online HD Map Construction,"Kanak Mazumder, Fabian B. Flohr",,arXiv:2601.10512v2,"Online HD map prediction, Satellite map prior, Vectorized HD map",SatMap is an online vectorized HD map estimation method that integrates satellite maps with multi-view camera observations to improve depth perception and accuracy in autonomous driving.,16.95,Phi-4,AMD RX 6800 (Vulkan)
2601.10520v1_Breaking Up with Normatively Monolithic Agency wit.pdf,Breaking Up with Normatively Monolithic Agency with GRACE: A Reason-Based Neuro-Symbolic Architecture for Safe and Ethical AI Alignment,"Felix Jahn, Yannic Muskalla, Lisa Dargasz, Patrick Schramowski, Kevin Baum",,2601.10520v1,"AI alignment, neuro-symbolic architecture, normative reasoning, ethical AI, deontic logic, AI containment","The paper introduces GRACE, a neuro-symbolic reason-based containment architecture that decouples normative reasoning from instrumental decision-making to ensure AI agents are safe, ethical, and aligned with human values.",17.43,Phi-4,AMD RX 6800 (Vulkan)
2601.10524v1_Diagnosing Generalization Failures in Fine-Tuned L.pdf,Diagnosing Generalization Failures in Fine-Tuned LLMs: A Cross-Architectural Study on Phishing Detection,"Frank Bobe III, Gregory D. Vetaw, Chase Pavlick, Darshan Bryner, Matthew Cook, Jose Salas-Vernis",,arXiv:2601.10524v1,"Large Language Models, fine-tuning, generalization failure, phishing detection, SHAP analysis, mechanistic interpretability, AI security","This study introduces a diagnostic framework to analyze generalization failures in fine-tuned LLMs, revealing the importance of architecture and data diversity in phishing detection tasks.",17.77,Phi-4,AMD RX 6800 (Vulkan)
2601.10527v2_A Safety Report on GPT-5.2 Gemini 3 Pro Qwen3-VL G.pdf,"A Safety Report on GPT-5.2, Gemini 3 Pro, Qwen3-VL, Grok 4.1 Fast, Nano Banana Pro, and Seedream 4.5","Xingjun Ma, Yixu Wang, Hengyuan Xu, Yutao Wu, Yifan Ding, Yunhan Zhao, Zilong Wang, Jiabin Hua, Ming Wen, Jianan Liu, Ranjie Duan, Yifeng Gao, Yingshui Tan, Yunhao Chen, Hui Xue, Xin Wang, Wei Cheng, Jingjing Chen, Zuxuan Wu, Bo Li, Yu-Gang Jiang",,arXiv:2601.10527v2,"Large Language Models, Multimodal Large Language Models, Safety Evaluation, Adversarial Evaluation, Multilingual Evaluation, Compliance Evaluation","This report presents an integrated safety evaluation of six frontier models, revealing a highly uneven safety landscape and highlighting the need for standardized, holistic safety assessments.",20.2,Phi-4,AMD RX 6800 (Vulkan)
2601.10543v1_Defending Large Language Models Against Jailbreak .pdf,Defending Large Language Models Against Jailbreak Attacks via In-Decoding Safety-Awareness Probing,"Yinzhi Zhao, Ming Wang, Shi Feng, Xiaocui Yang, Daling Wang, Yifei Zhang",,,"Large Language Models, Jailbreak Attacks, Safety Alignment, Decoding Process, Safety Signals","This paper proposes a method to enhance the safety of large language models by leveraging latent safety signals during the decoding process to detect and prevent jailbreak attacks, maintaining low over-refusal rates and preserving response quality.",15.95,Phi-4,AMD RX 6800 (Vulkan)
2601.10560v1_Learning Latency-Aware Orchestration for Parallel .pdf,Learning Latency-Aware Orchestration for Parallel Multi-Agent Systems,"Xi Shi, Mengxin Zheng, Qian Lou",,,"Multi-agent systems, Latency-aware orchestration, Parallel execution, Machine learning, Agent systems","This paper introduces LAMaS, a latency-aware multi-agent orchestration framework that optimizes execution paths for parallel execution, reducing critical path length by 38–46% while maintaining or improving task performance.",15.41,Phi-4,AMD RX 6800 (Vulkan)
2601.10562v1_Process-Guided Concept Bottleneck Model.pdf,Process-Guided Concept Bottleneck Model,"Reza M. Asiyabi, Sam Harrison, John L. Godlee, David Milodowski, Nicole H. Augustin, Penelope J. Mograbi, Timothy R. Baker, Lorena M. Benitez, Samuel J. Bowers, Thomas K. Brade, Joao M. B. Carreiras, Duncan M. Chalo, Vera De Cauwer, Kyle G. Dexter, Hermane Diesse, Mathias I. Disney, Luisa F. Escobar-Alvarado, Manfred Finckh, Tatenda Gotore, Gabriele C. Hegerl, John N. Kigomo, Fainess C. Lumbwe, Francisco Maiato, Rudzani A. Makhado, Collins W. Masinde, Musingo Tito E. Mbuvi, Iain M. McNicol, Edward T.A. Mitchard, Buster P. Mogonong, Wilson A. Mugasha, Aristides Baptista Muhate, Hinji Mutondo, Leena Naftal, Paula Nieto-Quintano, Elifuraha Elisha Njoghomi, Catherine L. Parr, Oliver L. Phillips, Pierre Proces, Tshililo Ramaswiela, Jayashree Ratnam, Mathew Rees, Rasmus Revermann, Natasha Ribeiro, Mahesh Sankaran, Abel M. Siampale, Stephen Sitch, Kathleen G. Smart, Hemant G. Tripathi, Wayne Twine, Gabriel I.K. Uusiku, Helga van der Merwe, Chemuku Wekesa, Benjamin J. Wigley, Mathew Williams, Ellie Wood, Emily Woollen, Shaun Quegan, Steven Hancock, Casey M. Ryan",,,,"This study introduces a Process-Guided Concept Bottleneck Model, supported by various grants and contributions, focusing on AI-assisted tools for scientific content and methodological development.",20.36,Phi-4,AMD RX 6800 (Vulkan)
2601.10567v1_Generative AI collective behavior needs an interac.pdf,Generative AI collective behavior needs an interactionist paradigm,"Laura Ferrarotti, Gian Maria Campedelli, Roberto Dessì, Andrea Baronchelli, Giovanni Iacca, Kathleen M. Carley, Alex Pentland, Joel Z. Leibo, James Evans, Bruno Lepri",,2601.10567v1,"cs.AI, LLMs, interactionist paradigm, collective behavior, multi-agent systems","The paper argues for an interactionist paradigm to understand the collective behavior of agents based on large language models, emphasizing the need for new theoretical foundations, methodologies, and analytical tools.",21.29,Phi-4,AMD RX 6800 (Vulkan)
2601.10581v1_From Single to Multi-Agent Reasoning Advancing Gen.pdf,From Single to Multi-Agent Reasoning: Advancing GeneGPT for Genomics QA,"Kimia Abedini, Farzad Shami, Gianmaria Silvello",,arXiv:2601.10581v1,"Question Answering, Genomic QA, Multi-Agent Systems","We propose GenomAgent, a multi-agent framework that coordinates specialized agents for complex genomics queries, outperforming GeneGPT by 12% on average and extending beyond genomics to various scientific domains.",17.66,Phi-4,AMD RX 6800 (Vulkan)
2601.10587v1_Adversarial Evasion Attacks on Computer Vision usi.pdf,Adversarial Evasion Attacks on Computer Vision using SHAP Values,"Frank Mollard, Marcus Becker, Florian Röhrbein",,arXiv:2601.10587v1,"adversarial attacks, computer vision, SHAP values, deep learning, evasion attacks, gradient hiding, misclassification","The paper introduces a white-box attack on computer vision models using SHAP values, demonstrating how adversarial evasion attacks can compromise deep learning models by reducing output confidence or inducing misclassifications.",21.43,Phi-4,AMD RX 6800 (Vulkan)
2601.10591v1_ProbFM Probabilistic Time Series Foundation Model .pdf,ProbFM: Probabilistic Time Series Foundation Model with Uncertainty Decomposition,"Arundeep Chinta, Lucas Vinh Tran, Jay Katukuri",,,"Time Series Foundation Models, Uncertainty Quantification, Deep Evidential Regression, Epistemic-Aleatoric Decomposition, Financial Forecasting","This paper introduces ProbFM, a novel transformer-based probabilistic framework that leverages Deep Evidential Regression for principled uncertainty quantification with explicit epistemic-aleatoric decomposition, demonstrating its effectiveness in financial applications.",16.34,Phi-4,AMD RX 6800 (Vulkan)
2601.10600v1_Procedural Fairness in Multi-Agent Bandits.pdf,Procedural Fairness in Multi-Agent Bandits,"Joshua Caiata, Carter Blair, Kate Larson",,arXiv:2601.10600v1,"multi-agent systems, fairness, procedural fairness, multi-armed bandits, equal voice, decision-making","This paper introduces procedural fairness in multi-agent multi-armed bandits, emphasizing equal decision-making power and legitimacy over outcome-based fairness.",16.02,Phi-4,AMD RX 6800 (Vulkan)
2601.10611v1_Molmo2 Open Weights and Data for Vision-Language M.pdf,Open Weights and Data for Vision-Language Models with Video Understanding and Grounding,"Christopher Clark, Jieyu Zhang, Zixian Ma, Jae Sung Park, Mohammadreza Salehi, Rohun Tripathi, Sangho Lee, Zhongzheng Ren, Chris Dongjoo Kim, Yinuo Yang, Vincent Shao, Yue Yang, Weikai Huang, Ziqi Gao, Taira Anderson, Jianrui Zhang, Jitesh Jain, George Stoica, Winson Han, Ali Farhadi, Ranjay Krishna",,arXiv:2601.10611v1,"vision-language models, video understanding, grounding, open-source, video datasets, model training, bi-directional attention, token-weight strategy","Molmo2 introduces open-source vision-language models with new video datasets and training techniques, achieving state-of-the-art performance in video understanding and grounding tasks.",20.04,Phi-4,AMD RX 6800 (Vulkan)
2601.10651v1_Multi-Property Synthesis.pdf,Multi-Property Synthesis,"Christoph Weinhuber, Yannik Schnitzer, Alessandro Abate, David Parker, Giuseppe De Giacomo, Moshe Y. Vardi",,,"LTLf synthesis, multiple properties, finite-horizon tasks, Boolean goal variables, symbolic algorithm, product-game states","The paper presents a symbolic algorithm for LTLf synthesis with multiple properties, achieving maximal realizable sets without enumerating subsets of properties, outperforming enumeration-based methods.",16.06,Phi-4,AMD RX 6800 (Vulkan)
2601.10679v1_Are Your Reasoning Models Reasoning or Guessing A .pdf,A Mechanistic Analysis of Hierarchical Reasoning Models,"Zirui Ren, Ziming Liu",,,"Hierarchical reasoning model, reasoning patterns, fixed point property, data augmentation, input perturbation, model bootstrapping, Sudoku-Extreme","This study analyzes the reasoning patterns of hierarchical reasoning models (HRM), revealing their tendency to 'guess' rather than 'reason', and proposes strategies to enhance their performance.",14.14,Phi-4,AMD RX 6800 (Vulkan)
2601.10681v1_Structure and Diversity Aware Context Bubble Const.pdf,Structure and Diversity Aware Context Bubble Construction for Enterprise Retrieval,"Amir Khurshid, Abhishek Sehgal",,,"Large Language Model, Retrieval-Augmented Generation, Context Bubble, Retrieval","This paper proposes a structure-informed and diversity-constrained context bubble construction framework to assemble coherent, citable bundles of spans under a strict token budget, improving query relevance and reducing redundancy in enterprise document retrieval.",15.57,Phi-4,AMD RX 6800 (Vulkan)
2601.10684v1_On the origin of neural scaling laws from random g.pdf,On the origin of neural scaling laws: from random graphs to natural language,"Maissam Barkeshli, Alberto Alfarano, Andrey Gromov",,,"neural scaling laws, transformers, random walks, graphs, natural language, scaling exponents, Erdös-Renyi, scale-free, Barabási-Albert, language modeling, parameter efficiency","This paper investigates the origin of neural scaling laws by studying transformers trained on random walks on graphs and simplified natural language models, revealing scaling laws even without power law data structures and analyzing scaling exponents.",17.06,Phi-4,AMD RX 6800 (Vulkan)
2601.10696v1_The Impact of Generative AI on Architectural Conce.pdf,"The Impact of Generative AI on Architectural Conceptual Design: Performance, Creative Self-Efficacy and Cognitive Load","Han Jiang, Yao Xiao, Rachel Hurley, Shichao Liu",,,"Visual communication, Architectural design, Learning, Performance Assessment, Hybrid Intelligence, Human-AI teaming","This study examines how generative AI influences performance, creative self-efficacy, and cognitive load in architectural conceptual design tasks, revealing that its effectiveness depends on users' prior expertise and interaction strategies.",19.44,Phi-4,AMD RX 6800 (Vulkan)
2601.10700v2_LIBERTy A Causal Framework for Benchmarking Concep.pdf,LIBERTy: A Causal Framework for Benchmarking Concept-Based Explanations of LLMs with Structural Counterfactuals,"Gilat Toker, Nitay Calderon, Ohad Amosy, Roi Reichart",,,"concept-based explanations, LLMs, structural counterfactuals, causal framework, explainability, interventions, causal effects, benchmarking","LIBERTy introduces a framework for constructing datasets with structural counterfactual pairs to benchmark concept-based explanations of LLMs, enabling systematic analysis of model sensitivity to interventions.",15.76,Phi-4,AMD RX 6800 (Vulkan)
2601.10702v1_Grounding Agent Memory in Contextual Intent.pdf,Grounding Agent Memory in Contextual Intent,"Ruozhen Yang, Yucheng Jiang, Yueqi Jiang, Priyanka Kargupta, Yunyi Zhang, Jiawei Han",,,"large language models, memory systems, contextual intent, retrieval cues, long-horizon interactions, goal-oriented interactions","STITCH, a structured intent-tracking system, improves memory retrieval in long-horizon interactions by indexing trajectory steps with contextual intent, achieving state-of-the-art performance in context-aware retrieval benchmarks.",14.77,Phi-4,AMD RX 6800 (Vulkan)
2601.10712v1_MatchTIR Fine-Grained Supervision for Tool-Integra.pdf,MatchTIR: Fine-Grained Supervision for Tool-Integrated Reasoning via Bipartite Matching,"Changle Qu, Sunhao Dai, Hengyi Cai, Jun Xu, Shuaiqiang Wang, Dawei Yin",,,"Tool-Integrated Reasoning, Large Language Models, Reinforcement Learning, Bipartite Matching, Fine-Grained Supervision",MatchTIR introduces fine-grained supervision for Tool-Integrated Reasoning by using bipartite matching-based turn-level reward assignment and dual-level advantage estimation to improve the effectiveness of tool calls in complex tasks.,15.71,Phi-4,AMD RX 6800 (Vulkan)
2601.10748v1_AnyECG Evolved ECG Foundation Model for Holistic H.pdf,AnyECG: Evolved ECG Foundation Model for Holistic Health Profiling,"Jun Li, Hongling Zhu, Yujie Xiao, Qinghao Zhao, Y alei Ke, Gongzheng Tang, Guangkun Nie, Deyun Zhang, Jin Li, Canqing Yu, Shenda Hong",,,"AI-ECG, electrocardiography, holistic health profiling, transfer learning, comorbidity identification, future risk prediction","This study presents AnyECG, an evolved ECG foundation model that enhances holistic health profiling by integrating a large-scale ECG dataset for comprehensive disease screening, long-term risk prediction, and comorbidity pattern recognition.",17.89,Phi-4,AMD RX 6800 (Vulkan)
2601.10768v1_Optimisation of complex product innovation process.pdf,OPTIMISATION OF COMPLEX PRODUCT INNOVATION PROCESSES BASED ON TREND MODELS WITH THREE-VALUED LOGIC,"Nina Bočková, Barbora Volná, Miroslav Dohnal",,2601.10768v1,"Complex product innovation, technological forecasting, three-valued logic, trend-based modelling, scenarios, transition graphs","This paper investigates complex product-innovation processes using models grounded in a set of heuristics, represented by simple trends and transition graphs.",19.06,Phi-4,AMD RX 6800 (Vulkan)
2601.10770v1_Unifying Speech Recognition Synthesis and Conversi.pdf,"UNIFYING SPEECH RECOGNITION, SYNTHESIS AND CONVERSION WITH AUTOREGRESSIVE TRANSFORMERS","Runyuan Cai, Yu Lin, Yiming Wang, Chunlin Fu, Xiaodong Zeng",,arXiv:2601.10770v1,"Text-to-Speech, Automatic Speech Recognition, Voice Conversion, Foundation Model","This paper introduces General-Purpose Audio (GPA), a unified audio foundation model that integrates multiple core speech tasks within a single large language model architecture, enabling flexible performance of TTS, ASR, and VC without architectural modifications.",17.58,Phi-4,AMD RX 6800 (Vulkan)
2601.10773v1_LogicLens Leveraging Semantic Code Graph to explor.pdf,LogicLens: Leveraging Semantic Code Graph to explore Multi Repository large systems,"Niko Usai, Dario Montagnini, Kristian Ilianov Iliev, Raffaele Camanzo",,,"semantic code graph, multi-repository systems, software knowledge graph, large language models, conversational agent, code analysis, impact analysis, symptom-based debugging","LogicLens is a conversational agent that assists developers in exploring complex software systems through a semantic multi-repository graph, enabling natural language interaction and dynamic retrieval of relevant subgraphs.",17.17,Phi-4,AMD RX 6800 (Vulkan)
2601.10779v1_Unified Optimization of Source Weights and Transfe.pdf,Unified Optimization of Source Weights and Transfer Quantities in Multi-Source Transfer Learning: An Asymptotic Framework,"Qingyue Zhang, Chang Chu, Haohao Fu, Tianren Peng, Yanru Wu, Guanbo Huang, Yang Li, Shao-Lun Huang",,,"transfer learning, multi-source learning, asymptotic analysis, K-L divergence","This paper proposes a theoretical framework, Unified Optimization of Weights and Quantities (UOWQ), for multi-source transfer learning, optimizing both source weights and transfer quantities to improve model performance in data-scarce scenarios.",17.59,Phi-4,AMD RX 6800 (Vulkan)
2601.10810v1_Digital Metabolism Decoupling Logic from Facts via.pdf,Digital Metabolism: Decoupling Logic from Facts via Regenerative Unlearning Towards a Pure Neural Logic Core,"Mengmeng Peng, Zhenyu Fang, He Sun",,arXiv:2601.10810v1,"Large language models, parameter entanglement, neural logic core, regenerative unlearning, deep learning, LLMs","This paper proposes 'digital metabolism' to decouple logic from facts in large language models, introducing the Regenerative Logic-Core Protocol to achieve a pure neural logic core, resulting in improved reasoning capabilities.",17.57,Phi-4,AMD RX 6800 (Vulkan)
2601.10820v1_Towards Reliable ML Feature Engineering via Planni.pdf,Towards Reliable ML Feature Engineering via Planning in Constrained-Topology of LLM Agents,"Himanshu Thakur, Anusha Kamath, Anurag Muthyala, Dhwani Sanmukhani, Smruthi Mukund, Jay Katukuri",,arXiv:2601.10820v1,"ML Feature Engineering, LLM Agents, Code Generation, Human-AI Collaboration, Multi-Agent Framework","This paper presents a planner-guided, constrained-topology multi-agent framework to automate feature engineering, improving reliability and efficiency by leveraging a team's environment and reducing feature engineering cycles significantly.",18.29,Phi-4,AMD RX 6800 (Vulkan)
2601.10827v1_Approximately Optimal Global Planning for Contact-.pdf,Approximately Optimal Global Planning for Contact-Rich SE(2) Manipulation on a Graph of Reachable Sets,"Simin Liu, Tong Zhao, Bernhard Paus Graesdal, Peter Werner, Jiuguang Wang, John Dolan, Changliu Liu, Tao Pang",,,"Full-body manipulation, dexterous manipulation, manipulation planning","This paper introduces a new paradigm for approximately optimal manipulator plans in contact-rich manipulation, demonstrating significant performance improvements over existing planners.",16.9,Phi-4,AMD RX 6800 (Vulkan)
2601.10835v1_Can Vision-Language Models Understand Construction.pdf,Can Vision-Language Models Understand Construction Workers? An Exploratory Study,"Hieu Bui, Nathaniel E. Chodosh, Arash Tavakoli",,,"Large Language Model, Construction Automation, Robotics, Human Robot Interaction","This study evaluates the performance of three leading Vision-Language Models in recognizing construction worker actions and emotions from static site images, highlighting their potential and limitations in construction environments.",15.28,Phi-4,AMD RX 6800 (Vulkan)
2601.10880v1_Medical SAM3 A Foundation Model for Universal Prom.pdf,Medical SAM3: A Foundation Model for Universal Prompt-Driven Medical Image Segmentation,"Chongcong Jiang, Tianxingjian Ding, Chuhan Song, Jiachen Tu, Ziyang Yan, Yihua Shao, Zhenyi Wang, Yuzhang Shang, Tianyu Han, Yu Tian",,arXiv:2601.10880v1,"Medical Image Segmentation, Foundation Models, Fine-Tuning, SAM3","Medical SAM3 is a foundation model for universal prompt-driven medical image segmentation, fine-tuned on large-scale medical datasets to address domain shifts and enhance performance in complex scenarios.",19.37,Phi-4,AMD RX 6800 (Vulkan)
2601.10904v1_ARC Prize 2025 Technical Report.pdf,ARC Prize 2025: Technical Report,"François Chollet, Mike Knoop, Gregory Kamradt, Bryan Landers",,,"ARC-AGI, few-shot generalization, fluid intelligence, abstract reasoning, refinement loop, zero-pretraining deep learning, AI reasoning, benchmark contamination, interactive reasoning challenges","The ARC Prize 2025 competition focused on the ARC-AGI-2 dataset, highlighting the emergence of refinement loops in AI, with top scores reaching 24% on the private evaluation set, and discussing the constraints of current AI reasoning performance.",16.49,Phi-4,AMD RX 6800 (Vulkan)
2601.10917v1_Self-learned representation-guided latent diffusio.pdf,SELF-LEARNED REPRESENTATION-GUIDED LATENT DIFFUSION MODEL FOR BREAST CANCER CLASSIFICATION IN DEEP ULTRA VIOLET WHOLE SURFACE IMAGES,"Pouya Afshin, David Helminiak, Tianling Niu, Julie M. Jorns, Tina Yen, Bing Yu, Dong Hye Ye",,,"Breast Cancer Classification, Latent Diffusion Model, Self-Supervised Learning, Data Augmentation, Deep Ultraviolet Fluorescence Scanning Microscopy, Vision Transformer","This paper proposes an SSL-guided Latent Diffusion Model to generate synthetic training patches for breast cancer classification in DUV-FSM images, achieving high accuracy and reduced FID score.",17.55,Phi-4,AMD RX 6800 (Vulkan)
2601.10921v1_RobuMTL Enhancing Multi-Task Learning Robustness A.pdf,RobuMTL: Enhancing Multi-Task Learning Robustness Against Weather Conditions,"Tasneem Shaffee, Sherief Reda",,,"Multi-Task Learning, Robustness, Weather Conditions, Low-Rank Adaptation, Mixture-of-Experts",RobuMTL introduces a novel architecture to enhance the robustness of Multi-Task Learning (MTL) against adverse weather conditions by dynamically selecting task-specific hierarchical Low-Rank Adaptation (LoRA) modules.,15.45,Phi-4,AMD RX 6800 (Vulkan)
