filename,title,authors,doi,arxiv_id,keywords,summary,tps,model,platform
2601.07192v1_Relink Constructing Query-Driven Evidence Graph On.pdf,Constructing Query-Driven Evidence Graph On-the-Fly for GraphRAG,"Manzong Huang, Chenyang Bu, Yi He, Xingrui Zhuo, Xindong Wu",,,"GraphRAG, Knowledge Graph, Large Language Models, Retrieval-Augmented Generation, Open-Domain Question Answering","Relink proposes a dynamic framework for constructing query-specific evidence graphs to address the limitations of static Knowledge Graphs in GraphRAG, achieving significant improvements in accuracy.",14.35,Phi-4,AMD RX 6800 (Vulkan)
2601.07197v1_Beyond Variance Knowledge-Aware LLM Compression vi.pdf,Beyond Variance: Knowledge-Aware LLM Compression via Fisher-Aligned Subspace Diagnostics,"Ibne Farabi Shihab, Sanjeda Akter, Anuj Sharma",,,"LLM Compression, Fisher Information Matrix, Activation Compression, SVD, Knowledge Preservation, Transformer Architectures","FASC is a knowledge-aware compression framework for LLMs that preserves factual knowledge by selecting subspaces based on activation-gradient coupling, outperforming variance-based methods in accuracy on knowledge-intensive benchmarks.",15.71,Phi-4,AMD RX 6800 (Vulkan)
2601.07199v1_Forward versus Backward Comparing Reasoning Object.pdf,Forward versus Backward: Comparing Reasoning Objectives in Direct Preference Optimization,"Murtaza Nikazad, Raghuram Ramanujan",,,"reasoning capabilities, hallucination, Direct Preference Optimization, chain-of-thought generation, verification, GSM8K, Low-Rank Adaptation","This paper investigates the effect of training objective composition on reasoning reliability through Direct Preference Optimization, comparing forward chain-of-thought generation and backward verification, revealing distinct and complementary learning signals.",16.94,Phi-4,AMD RX 6800 (Vulkan)
2601.07200v1_Safeguarding LLM Fine-tuning via Push-Pull Distrib.pdf,Safeguarding LLM Fine-tuning via Push-Pull Distributional Alignment,"Haozhong Wang, Zhuo Li, Yibo Yang, He Zhao, Hongyuan Zha, Dandan Guo",,,"LLM, fine-tuning, safety alignment, Optimal Transport, data distribution, model safety",Introducing Safety Optimal Transport (SOT) to enhance model safety during LLM fine-tuning by aligning data distributions and establishing a robust safety boundary.,15.78,Phi-4,AMD RX 6800 (Vulkan)
2601.07201v1_CalPro Prior-Aware Evidential--Conformal Predictio.pdf,CalPro: Prior-Aware Evidential–Conformal Prediction with Structure-Aware Guarantees for Protein Structures,"Ibne Farabi Shihab, Sanjeda Akter, Anuj Sharma",,,"protein structure prediction, uncertainty quantification, conformal prediction, evidential learning, distribution shift, calibration","CalPro introduces a prior-aware evidential–conformal framework for robust uncertainty quantification in protein structure prediction, achieving improved calibration and coverage under distribution shifts.",15.33,Phi-4,AMD RX 6800 (Vulkan)
2601.07206v1_LLMRouterBench A Massive Benchmark and Unified Fra.pdf,LLMRouterBench: A Massive Benchmark and Unified Framework for LLM Routing,"Hao Li, Yiqun Zhang, Zhaoyan Guo, Chenxu Wang, Shengji Tang, Qiaosheng Zhang, Yang Chen, Biqing Qi, Peng Ye, Lei Bai, Zhen Wang, Shuyue Hu",,,"LLM routing, benchmark, framework, performance, cost trade-off, model ensemble","LLMRouterBench is a large-scale benchmark and unified framework for LLM routing, comprising over 400K instances from 21 datasets and 33 models, providing comprehensive metrics for performance-oriented and performance-cost trade-off routing.",16.78,Phi-4,AMD RX 6800 (Vulkan)
2601.07209v1_SIRR-LMM Single-image Reflection Removal via Large.pdf,SIRR-LMM: Single-image Reflection Removal via Large Multimodal Model,"Yu Guo, Zhiqiang Lao, Xiyun Song, Yubin Zhou, Heather Yu",,,"Single-image Reflection Removal, Large Multimodal Model, Synthetic Dataset, Path-tracing, LoRA","This paper introduces a synthetic dataset generation framework for single-image reflection removal using a Large Multimodal Model, achieving improved performance over state-of-the-art methods.",16.22,Phi-4,AMD RX 6800 (Vulkan)
2601.07214v1_BlindU Blind Machine Unlearning without Revealing .pdf,BlindU: Blind Machine Unlearning without Revealing Erasing Data,"Weiqi Wang, Zhiyi Tian, Chenhan Zhang, Shui Yu",,,"Machine Unlearning, Federated Learning, Privacy Leakage, Privacy Preserving, Information Bottleneck","This paper proposes Blind Unlearning (BlindU) to enable machine unlearning without revealing erasing data to the server, using compressed representations and a noise-free differential privacy masking method.",15.78,Phi-4,AMD RX 6800 (Vulkan)
2601.07224v1_Consolidation or Adaptation PRISM Disentangling SF.pdf,Consolidation or Adaptation? PRISM: Disentangling SFT and RL Data via Gradient Concentration,"Yang Zhao, Yangou Ouyang, Xiao Ding, Hepeng Wang, Bibo Cai, Kai Xiong, Jinglong Gao, Zhouhao Sun, Li Du, Bing Qin, Ting Liu",,,"Hybrid Supervised Fine-Tuning, Reinforcement Learning, Gradient Concentration, Schema Theory, Data Arbitration, Large Language Models, Agent Alignment","PRISM is a framework that arbitrates data between Supervised Fine-Tuning and Reinforcement Learning based on gradient concentration, improving alignment efficiency and reducing computational costs.",17.97,Phi-4,AMD RX 6800 (Vulkan)
2601.07226v1_Lost in the Noise How Reasoning Models Fail with C.pdf,Lost in the Noise: How Reasoning Models Fail with Contextual Distractors,"Seongyun Lee, Yongrae Jo, Minju Seo, Moontae Lee, Minjoon Seo",,,"reasoning models, contextual distractors, NoisyBench, robustness, RAG, tool-use tasks, agentic AI systems, Rationale-Aware Reward (RARE)","The paper introduces NoisyBench, a benchmark evaluating model robustness against diverse noise types, revealing significant performance drops in state-of-the-art models due to contextual distractors.",17.14,Phi-4,AMD RX 6800 (Vulkan)
2601.07229v2_DiSCo Making Absence Visible in Intelligent Summar.pdf,DiSCo: Making Absence Visible in Intelligent Summarization Interfaces,"ERAN FAINMAN, HAGIT BEN SHOSHAN, ADIR SOLOMON, OSNAT MOKRYN",,,"Human-centered computing, User studies, Information systems, Expert systems, Computing methodologies, Artificial intelligence, Review Summarization, Absence, Expectations, Learning via surprisability, Missing commonalities","DiSCo is an expectation-based computational approach that makes absences visible in intelligent summarization interfaces by comparing content with domain topical expectations, improving transparency and decision support.",17.61,Phi-4,AMD RX 6800 (Vulkan)
2601.07232v1_Yes FLoReNce I Will Do Better Next Time Agentic Fe.pdf,"Y es FLoReNce, I Will Do Better Next Time! Agentic Feedback Reasoning for Humorous Meme Detection","Olivia Shanhong Liu, Pai Chet Ng, De Wen Soh, Konstantinos N. Plataniotis",,,"humorous meme detection, agentic feedback reasoning, multimodal models, AI systems, humor interpretation","FLoReNce is a framework that improves meme humor understanding by using a closed-loop feedback process during learning and an open-loop process during inference, enhancing predictive performance and explanation quality.",16.31,Phi-4,AMD RX 6800 (Vulkan)
2601.07233v1_From Thinking to Justifying Aligning High-Stakes E.pdf,From “Thinking” to “Justifying”: Aligning High-Stakes Explainability with Professional Communication Standards,"Chen Qian, Yimeng Wang, Yu Chen, Lingfei Wu, Andreas Stathopoulos",,,"Explainable AI, Chain-of-Thought, Structured Explainability Framework, High-Stakes Domains, Professional Communication Standards","The paper proposes a 'Result → Justify' approach for Explainable AI in high-stakes domains, introducing SEF to improve verifiability and reliability by aligning with professional communication standards.",15.58,Phi-4,AMD RX 6800 (Vulkan)
2601.07238v1_Group Pattern Selection Optimization Let LRMs Pick.pdf,Group Pattern Selection Optimization: Let LRMs Pick the Right Pattern for Reasoning,"Hanbin Wang, Jingwei Song, Jinpeng Li, Fei Mi, Lifeng Shang",,,"Large reasoning models, reinforcement learning, pattern selection, mathematics benchmarks, science benchmarks, Chain-of-Thought, Proximal Policy Optimization, GRPO","This paper introduces Group Pattern Selection Optimization (GPSO), a reinforcement learning framework that enables large reasoning models to select optimal reasoning patterns for different problems, leading to consistent performance improvements across various benchmarks.",16.76,Phi-4,AMD RX 6800 (Vulkan)
2601.07239v1_Stochastic CHAOS Why Deterministic Inference Kills.pdf,"Stochastic CHAOS: Why Deterministic Inference Kills, and Distributional Variability Is the Heartbeat of Artificial Cognition","Tanmay Joshi, Shourya Aggarwal, Anusa Saha, Aadi Pandey, Shreyash Dhoot, Vighnesh Rai, Raxit Goswami, Aman Chadha, Vinija Jain, Amitava Das",,,"Large Language Models, Deterministic Inference, Stochastic Inference, Distributional Variability, Artificial Cognition, Reproducibility, Uncertainty Modeling, Emergent Abilities, Reasoning, Safety Alignment","The paper argues that deterministic inference in large language models (LLMs) limits their ability to model uncertainty, disrupts reasoning, and makes safety alignment brittle, advocating for stochastic inference to harness distributional variability as the core of artificial cognition.",18.77,Phi-4,AMD RX 6800 (Vulkan)
2601.07245v1_Learning to Trust the Crowd A Multi-Model Consensu.pdf,Learning to Trust the Crowd: A Multi-Model Consensus Reasoning Engine for Large Language Models,Pranav Kallem,,,"Large Language Models, Multi-Model Consensus, Reliability, Semantic Embeddings, Graph Neural Networks, LLM Diversity","This paper introduces a Multi-Model Consensus Reasoning Engine to improve the reliability of large language models by learning from the outputs of multiple heterogeneous models, achieving better accuracy and reduced hallucinations.",15.21,Phi-4,AMD RX 6800 (Vulkan)
2601.07250v1_DDT A Dual-Masking Dual-Expert Transformer for Ene.pdf,DDT: A Dual-Masking Dual-Expert Transformer for Energy Time-Series Forecasting,"Mingnan Zhu, Qixuan Zhang, Yixuan Cheng, Fangzhou Gu, Shiming Lin",,,"Time-Series Forecasting, Multivariate Temporal Modeling, Dynamic-Causal Masking, Adaptive Feature Fusion","DDT introduces a dual-masking mechanism and a dual-expert system for high-precision energy time-series forecasting, outperforming state-of-the-art baselines across various datasets.",16.49,Phi-4,AMD RX 6800 (Vulkan)
2601.07261v1_Pseudodata-guided Invariant Representation Learnin.pdf,Pseudodata-guided Invariant Representation Learning Boosts the Out-of-Distribution Generalization in Enzymatic Kinetic Parameter Prediction,"Haomin Wu, Zhiwei Nie, Hongyu Zhang, Zhixiang Ren",,2601.07261v1,"enzyme kinetic parameters, deep learning, enzyme-substrate interaction, OOD generalization, invariant representation learning","The paper introduces O2DENet, a module that enhances out-of-distribution generalization in enzyme kinetic parameter prediction by using biologically informed perturbation augmentation and invariant representation learning.",19.68,Phi-4,AMD RX 6800 (Vulkan)
2601.07263v1_When Bots Take the Bait Exposing and Mitigating th.pdf,When Bots Take the Bait: Exposing and Mitigating the Emerging Social Engineering Attack in Web Automation Agent,"Xinyi Wu, Geng Hong, Yueyue Chen, MingXuan Liu, Feier Jin, Xudong Pan, Jiarun Dai, Baojun Liu",,,"Web agents, Social engineering, Web automation, Security, Large language models, Attack mitigation","This paper presents a systematic study of social engineering attacks against web automation agents, introducing the AGENTBAIT paradigm and proposing the SUPERVISOR module to mitigate these attacks, significantly reducing their success rates.",17.07,Phi-4,AMD RX 6800 (Vulkan)
2601.07291v1_A Visual Semantic Adaptive Watermark grounded by P.pdf,A Visual Semantic Adaptive Watermark grounded by Prefix-Tuning for Large Vision-Language Model,"Qi Zheng, Shuliang Liu, Yu Huang, Sihang Jia, Jungang Li, Lyuhao Chen, Junhao Chen, Hanqian Li, Aiwei Liu, Yibo Yan, Xuming Hu",,,"watermarking, vision-language models, prefix-tuning, visual fidelity, semantic-aware methods, inference efficiency","The paper proposes VISA-Mark, a novel framework for embedding detectable signals in Large Vision-Language Models while preserving visual fidelity, achieving improved visual consistency and semantic fidelity without sacrificing inference efficiency.",17.16,Phi-4,AMD RX 6800 (Vulkan)
2601.07292v1_Photometric Redshift Estimation Using Scaled Ensem.pdf,Photometric Redshift Estimation Using Scaled Ensemble Learning,"Swagata Biswas, Shubhrangshu Ghosh, Avyarthana Ghosh, Yogesh Wadadekar, Abhishek Roy Choudhury, Arijit Mukherjee, Shailesh Deshpande, Arpan Pal",,,"Galaxies, High-redshift galaxies, Redshift surveys, Neural networks","This study presents a new ensemble-based machine learning framework for predicting photometric redshifts of faint galaxies using optical photometric data, demonstrating improved accuracy and reliability.",16.55,Phi-4,AMD RX 6800 (Vulkan)
2601.07296v1_LRAS Advanced Legal Reasoning with Agentic Search.pdf,LRAS: Advanced Legal Reasoning with Agentic Search,"Yujin Zhou, Chuxue Cao, Jinluan Yang, Lijun Wu, Conghui He, Sirui Han, Yike Guo",,,"Legal Reasoning, Agentic Search, Large Reasoning Models, Introspective Imitation Learning, Reinforcement Learning, Legal Logic","LRAS transitions legal LLMs from closed-loop reasoning to dynamic inquiry, improving legal reasoning by 8.2-32% through introspection and reinforcement learning.",16.38,Phi-4,AMD RX 6800 (Vulkan)
2601.07304v1_Heterogeneous Multi-Expert Reinforcement Learning .pdf,Heterogeneous Multi-Expert Reinforcement Learning for Long-Horizon Multi-Goal Tasks in Autonomous Forklifts,"Yun Chen, Bowei Huang, Fan Guo, Kang Song",,,"Autonomous Forklift, Hierarchical Reinforcement Learning, Mobile Manipulation, Hybrid Training, Modality Decoupling","This paper introduces a Heterogeneous Multi-Expert Reinforcement Learning framework for autonomous forklifts, addressing the challenge of balancing large-scale navigation and fine-grained object interaction by decomposing tasks into specialized sub-policies.",16.33,Phi-4,AMD RX 6800 (Vulkan)
2601.07309v1_ARM Role-Conditioned Neuron Transplantation for Tr.pdf,ARM: Role-Conditioned Neuron Transplantation for Training-Free Generalist LLM Agent Merging,"Zhuoka Feng, Kang Chen, Sihan Zhao, Kai Xiong, Yaoning Wang, Minshen Yu, Junjie Nian, Changyi Xiao, Yixin Cao, Yugang Jiang",,arXiv:2601.07309v1,"large language models, model merging, neuron transplantation, generalization, interactive environments","This paper introduces Agent-Role Merging (ARM), a method for training-free model merging in LLM agents, enhancing generalization across diverse environments without gradient-based optimization.",18.85,Phi-4,AMD RX 6800 (Vulkan)
2601.07313v1_Explaining Machine Learning Predictive Models thro.pdf,Explaining Machine Learning Predictive Models through Conditional Expectation Methods,"Silvia Ruiz-España, Laura Arnal, François Signol, Juan-Carlos Pérez-Cortes, Joaquim Arlandis",,,"machine learning, XAI, explainable models, local explainability, model-agnostic, uncertainty, stability","This work introduces Multivariate Conditional Expectation (MUCE), a model-agnostic method for local explainability designed to capture prediction changes from feature interactions, providing graphical explanations and quantitative indices for model reliability.",16.89,Phi-4,AMD RX 6800 (Vulkan)
2601.07315v1_VLM-CAD VLM-Optimized Collaborative Agent Design W.pdf,VLM-CAD: VLM-Optimized Collaborative Agent Design Workflow for Analog Circuit Sizing,"Guanyuan Pan, Yugui Lin, Tiansheng Zhou, Pietro Li, Shuai Wang, Yaqi Wang",,,"Analog Circuit Sizing, Agentic AI, Vision Language Model, Explainability, Electronic Design Automation","This paper introduces VLM-CAD, a workflow that uses Vision Language Models to optimize analog circuit sizing, offering explainability and efficiency in design processes.",16.1,Phi-4,AMD RX 6800 (Vulkan)
2601.07316v1_BEAT-Net Injecting Biomimetic Spatio-Temporal Prio.pdf,BEAT-Net: Injecting Biomimetic Spatio-Temporal Priors for Interpretable ECG Classification,"Ma Runze, Liao Caizhi",,2601.07316v1,"ECG classification, deep learning, biomimetic, spatio-temporal priors, interpretable AI, self-supervised learning","BEAT-Net reformulates ECG diagnosis as a language modeling task, using QRS tokenization to improve data efficiency and interpretability, matching CNN accuracy with less data.",17.32,Phi-4,AMD RX 6800 (Vulkan)
2601.07320v1_Segmental Advantage Estimation Enhancing PPO for L.pdf,Segmental Advantage Estimation: Enhancing PPO for Long-Context LLM,"Xue Gong, Qi Yi, Ziyuan Nan, Guanhua Huang, Kejiao Li, Yuhao Jiang, Ruibin Xiong, Zenan Xu, Jiaming Guo, Shaohui Peng, Bo Zhou",,,"Large Language Models, Reinforcement Learning, Verifiable Rewards, Proximal Policy Optimization, Advantage Estimation, Sparse Rewards, Generalized Advantage Estimation, Segmental Advantage Estimation",This paper introduces Segmental Advantage Estimation (SAE) to improve Proximal Policy Optimization (PPO) for training Large Language Models (LLMs) by addressing unreliable advantage estimation in sparse-reward Reinforcement Learning with Verifiable Rewards (RLVR) regimes.,18.61,Phi-4,AMD RX 6800 (Vulkan)
2601.07342v1_Agentic Diagnostic Reasoning over Telecom and Data.pdf,Agentic Diagnostic Reasoning over Telecom and Datacenter Infrastructure: Foundation for Autonomous Incident Resolution and Change Impact Mitigation,Nicolas Tacheny,,arXiv:2601.07342v1,"telecom, datacenter, root cause analysis, large language model, autonomous incident resolution, change impact mitigation",This work introduces an agentic diagnostic framework using a Large Language Model to autonomously navigate telecom and datacenter infrastructure models for incident resolution and change impact mitigation.,17.46,Phi-4,AMD RX 6800 (Vulkan)
2601.07344v1_PulseMind A Multi-Modal Medical Model for Real-Wor.pdf,PulseMind: A Multi-Modal Medical Model for Real-World Clinical Diagnosis,"Jiao Xu, Junwei Liu, Jiangwei Lao, Qi Zhu, Yunpeng Zhao, Congyun Jin, Shinan Liu, Zhihong Lu, Lihe Zhang, Xin Chen, Jian Wang, Ping Wang",,,"multi-modal models, clinical diagnosis, medical images, diagnostic dataset, evaluation benchmark, training framework, Comparison-based Reinforcement Policy Optimization","PulseMind introduces a new family of multi-modal diagnostic models integrating a curated dataset, evaluation benchmark, and tailored training framework to address the complexity of real-world clinical diagnostics.",17.21,Phi-4,AMD RX 6800 (Vulkan)
2601.07348v4_Controlled Self-Evolution for Algorithmic Code Opt.pdf,Controlled Self-Evolution for Algorithmic Code Optimization,"Tu Hu, Ronghao Chen, Shuo Zhang, Jianghao Yin, Mou Xiao Feng, Jingping Liu, Shaolei Zhang, Wenqi Jiang, Yuqi Fang, Sen Hu, Huacan Wang, Yi Xu",,arXiv:2601.07348v4,"self-evolution, code optimization, algorithmic strategies, genetic evolution, hierarchical memory, exploration efficiency","This paper introduces Controlled Self-Evolution (CSE) to enhance code generation by addressing initialization bias, uncontrolled stochastic operations, and insufficient experience utilization, achieving higher efficiency and continuous improvement in algorithmic code optimization.",20.29,Phi-4,AMD RX 6800 (Vulkan)
2601.07351v2_Beyond Hard Masks Progressive Token Evolution for .pdf,Beyond Hard Masks: Progressive Token Evolution for Diffusion Language Models,"Linhao Zhong, Linyu Wu, Bozhen Fang, Tianjian Feng, Chenchen Jing, Wen Wang, Jiaheng Zhang, Hao Chen, Chunhua Shen",,,"Diffusion Language Models, EvoToken-DLM, soft token distributions, iterative refinement, probabilistic representations","EvoToken-DLM introduces evolving soft token distributions in diffusion language models, enabling revisable decoding and superior performance over existing baselines.",15.19,Phi-4,AMD RX 6800 (Vulkan)
2601.07356v1_Efficient Convolutional Forward Model for Passive .pdf,Efficient Convolutional Forward Model for Passive Acoustic Mapping and Temporal Monitoring,"Tatiana Gelvez-Barrera, Barbara Nicolas, Bruno Gilles, Adrian Basarab, Denis Kouam ´e",,,"Passive Acoustic Mapping, Model-based beamforming, Convolutional forward model, Temporal monitoring","This paper introduces a novel convolutional formulation for passive acoustic mapping (PAM) that enhances computational efficiency and temporal resolution, outperforming classical beamforming methods.",15.74,Phi-4,AMD RX 6800 (Vulkan)
2601.07359v1_Seeing Right but Saying Wrong Inter- and Intra-Lay.pdf,Seeing Right but Saying Wrong: Inter- and Intra-Layer Refinement in MLLMs without Training,"Shezheng Song, Shasha Li, Jie Yu",,,"Multimodal Large Language Models, MLLMs, vision-language tasks, attention, layer-wise refinement, head-wise refinement, DualPD, accuracy improvement","This paper introduces DualPD, a dual-perspective decoding refinement strategy that enhances MLLMs' visual understanding without additional training, addressing the issue of models 'seeing it right but saying it wrong' by refining inter- and intra-layer attention.",16.64,Phi-4,AMD RX 6800 (Vulkan)
2601.07364v1_On the universal definition of intelligence.pdf,On the universal definition of intelligence: A definition for Human - AI Comparison,Joseph Chen,,,"intelligence, AI, human comparison, R. Carnap, conceptual clarification, predictive ability, Extended Predictive Hypothesis (EPH)","This paper proposes a universal definition of intelligence, the Extended Predictive Hypothesis (EPH), to enable fair and consistent comparison of human and artificial intelligence.",19.38,Phi-4,AMD RX 6800 (Vulkan)
2601.07372v1_Conditional Memory via Scalable Lookup A New Axis .pdf,Conditional Memory via Scalable Lookup: A New Axis of Sparsity for Large Language Models,"Xin Cheng, Wangding Zeng, Damai Dai, Qinyu Chen, Bingxuan Wang, Zhenda Xie, Kezhao Huang, Xingkai Yu, Zhewen Hao, Yukun Li, Han Zhang, Huishuai Zhang, Dongyan Zhao, Wenfeng Liang",,2601.07372v1,"Mixture-of-Experts, Transformers, knowledge lookup, conditional memory, Engram, sparsity, large language models, MoE, static memory, scaling law, reasoning, code/math domains, long-context retrieval, runtime prefetching","Introducing conditional memory as a complementary sparsity axis for large language models, instantiated via Engram, which optimizes the trade-off between neural computation and static memory, enhancing performance in various domains.",19.37,Phi-4,AMD RX 6800 (Vulkan)
2601.07376v1_OpenTinker Separating Concerns in Agentic Reinforc.pdf,OpenTinker: Separating Concerns in Agentic Reinforcement Learning,"Siqi Zhu, Jiaxuan You",,arXiv:2601.07376v1,"Reinforcement Learning, Large Language Models, Agent-Environment Interaction, Decomposition, Managed Execution Runtime, Multi-Agent Training","OpenTinker introduces an infrastructure for RL of large language model agents, emphasizing separation of concerns across algorithm design, execution, and agent-environment interaction, with a focus on composable components and a centralized scheduler for managing workloads.",16.68,Phi-4,AMD RX 6800 (Vulkan)
2601.07377v1_Learning Dynamic Collaborative Network for Semi-su.pdf,Learning Dynamic Collaborative Network for Semi-supervised 3D Vessel Segmentation,"Jiao Xu, Xin Chen, Lihe Zhang",,,"3D vessel segmentation, semi-supervised learning, dynamic collaborative network, mean teacher, multi-view integration, adversarial supervision","This paper introduces a dynamic collaborative network for semi-supervised 3D vessel segmentation, addressing the limitations of static mean teacher methods by allowing dynamic role switching between teacher and student models, and incorporating multi-view integration and adversarial supervision to improve segmentation performance.",15.48,Phi-4,AMD RX 6800 (Vulkan)
2601.07389v1_On the Non-decoupling of Supervised Fine-tuning an.pdf,On the Non-decoupling of Supervised Fine-tuning and Reinforcement Learning in Post-training,"Xueyan Niu, Bo Bai, Wei Han, Wei Xi Zhang",,arXiv:2601.07389v1,"Supervised Fine-tuning, Reinforcement Learning, Post-training, Large Language Models, Decoupling, Optimality","The paper proves that supervised fine-tuning and reinforcement learning in post-training cannot be decoupled without performance loss, as each method negatively impacts the other's objectives.",17.32,Phi-4,AMD RX 6800 (Vulkan)
2601.07392v1_OceanSAR-2 A Universal Feature Extractor for SAR O.pdf,OceanSAR-2: A Universal Feature Extractor for SAR Ocean Observation,"Alexandre Tuela, Thomas Kerdreux, Quentin Febvre, Alexis Mouche, Antoine Grouazel, Jean-Renaud Miadana, Antoine Audras, Chen Wang, Bertrand Chapron",,,"SAR, ocean observation, self-supervised learning, foundation model, Sentinel-1 Wave Mode, geophysical pattern classification, ocean surface wind vector, significant wave height estimation, iceberg detection","OceanSAR-2 is a second-generation foundation model for SAR-based ocean observation, enhancing performance through improved self-supervised learning and dynamic data curation, demonstrating strong transfer performance across various downstream tasks.",18.03,Phi-4,AMD RX 6800 (Vulkan)
2601.07393v1_Software-Hardware Co-optimization for Modular E2E .pdf,"Software-Hardware Co-Optimization for Modular E2E: A Unified Framework of Optimization Approaches, Simulation Environment and Evaluation Metrics","Chengzhi Ji, Xingfeng Li, Zhaodong Lv, Hao Sun, Pan Liu, Hao Frank Yang, Ziyuan Pu",,2601.07393v1,"Modular end-to-end, Closed-Loop Evaluation, Software–Hardware co-optimization, Energy Consumption","This paper proposes a software–hardware co-optimization framework for ME2E autonomous driving inference, integrating software and hardware optimizations to improve deployability, reduce latency, and energy consumption, while preserving accuracy.",18.29,Phi-4,AMD RX 6800 (Vulkan)
