filename,title,authors,doi,arxiv_id,keywords,summary,tps,model,platform
2601.08768v1_AI as Entertainment.pdf,AI as Entertainment,"Cody Kommers, Ari Holtzman",https://doi.org/XXXXXXX.XXXXXXX,,"Generative AI, Entertainment, Culture, LLMs, Societal Impact, Meaning-making","The paper argues that AI's role in entertainment, particularly for young people, is underexplored and proposes a framework for evaluating AI-generated cultural content beyond minimizing harm.",15.13,Phi-4,AMD RX 6800 (Vulkan)
2601.08773v1_Reliable Graph-RAG for Codebases AST-Derived Graph.pdf,Reliable Graph-RAG for Codebases: AST-Derived Graphs vs LLM-Extracted Knowledge Graphs,Manideep Reddy Chinthareddy,,2601.08773v1,"Retrieval-Augmented Generation, RAG, software engineering, vector similarity search, multi-hop architectural reasoning, Knowledge Graph, AST-derived, LLM-Generated Knowledge Graph, Tree-sitter parsing, Java codebases","This paper benchmarks three retrieval pipelines for software engineering, focusing on vector similarity search and multi-hop architectural reasoning, comparing No-Graph Naive RAG, LLM-Generated Knowledge Graph RAG, and AST-derived Knowledge Graph RAG.",18.98,Phi-4,AMD RX 6800 (Vulkan)
2601.08776v1_Translating Light-Sheet Microscopy Images to Virtu.pdf,Translating Light-Sheet Microscopy Images to Virtual H&E Using CycleGAN,Yanhua Zhao,,,"Histopathology, image translation, H&E staining, unpaired learning, CycleGAN","This paper presents a CycleGAN approach for unpaired image-to-image translation from multi-channel fluorescence microscopy to pseudo H&E stained histopathology images, enabling visualization of fluorescence data in a format familiar to pathologists.",15.73,Phi-4,AMD RX 6800 (Vulkan)
2601.08777v1_Asymptotic Universal Alignment A New Alignment Fra.pdf,Asymptotic Universal Alignment: A New Alignment Framework via Test-Time Scaling,"Yang Cai, Weiqiang Zheng",,2601.08777v1,"large language models, alignment, test-time scaling, Nash learning, self-play learning, multi-player games","This paper introduces a framework for aligning large language models to user preferences through test-time scaling, achieving optimal convergence rates and preserving output diversity.",17.93,Phi-4,AMD RX 6800 (Vulkan)
2601.08778v3_Pervasive Annotation Errors Break Text-to-SQL Benc.pdf,Pervasive Annotation Errors Break Text-to-SQL Benchmarks and Leaderboards,"Tengjun Jin, Yoojin Choi, Yuxuan Zhu, Daniel Kang",,,"text-to-SQL, annotation errors, benchmarks, leaderboards, data analytics, data-driven applications","This paper investigates annotation errors in text-to-SQL benchmarks, revealing high error rates and their significant impact on agent performance and leaderboard rankings.",15.1,Phi-4,AMD RX 6800 (Vulkan)
2601.08785v1_Uncovering Political Bias in Large Language Models.pdf,Uncovering Political Bias in Large Language Models using Parliamentary Voting Records,"Jieying Chen, Karen de Jong, Andreas Poole, Jan Burakowski, Elena Elderson Nosti, Joep Windt, Chendi Wang",https://doi.org/XXXXXXX.XXXXXXX,,"Political bias, Large language models, Ideological alignment, Multilingual NLP, Benchmarking, Bias evaluation, Parliamentary motions, LLM fairness",This paper introduces a methodology for constructing political-bias benchmarks using parliamentary voting records to assess ideological tendencies and political entity bias in large language models.,17.17,Phi-4,AMD RX 6800 (Vulkan)
2601.08806v1_APEX-SWE.pdf,APEX–SWE: A Benchmark for Assessing AI Models in Software Engineering,"Abhi Kottamasu, Akul Datta, Aakash Barthwal, Ajay Arun, Chirag Mahapatra, Adarsh Hiremath, Brendan Foody, Bertie Vidgen",,arXiv:2601.08806v1,"AI Productivity Index, Software Engineering, Integration tasks, Observability tasks, AI models, benchmark, epistemic reasoning","APEX–SWE is a benchmark for assessing AI models' ability to perform economically valuable software engineering tasks, focusing on integration and observability tasks in real-world scenarios.",17.99,Phi-4,AMD RX 6800 (Vulkan)
2601.08807v1_S3-CLIP Video Super Resolution for Person-ReID.pdf,S3-CLIP: Video Super Resolution for Person-ReID,"Tamás Endrei, György Cserey",,,"Video Super Resolution, Person Re-Identification, ReID, Cross-view Conditions, Super-resolution Networks, CLIP-ReID Framework","This paper introduces S3-CLIP, a video super-resolution-based CLIP-ReID framework for enhancing tracklet quality in person re-identification, particularly under challenging cross-view conditions, achieving competitive performance in aerial-to-ground and ground-to-aerial scenarios.",15.36,Phi-4,AMD RX 6800 (Vulkan)
2601.08808v1_Multiplex Thinking Reasoning via Token-wise Branch.pdf,Multiplex Thinking: Reasoning via Token-wise Branch-and-Merge,"Yao Tang, Li Dong, Yaru Hao, Qingxiu Dong, Furu Wei, Jiatao Gu",,arXiv:2601.08808v1,"Large Language Models, Chain-of-Thought, Reinforcement Learning, Continuous Reasoning Tokens, Mathematical Reasoning","The paper introduces Multiplex Thinking, a stochastic soft reasoning mechanism that samples candidate tokens and aggregates their embeddings into a single multiplex token, optimizing reasoning trajectories with on-policy reinforcement learning while maintaining sequence compactness.",16.84,Phi-4,AMD RX 6800 (Vulkan)
2601.08811v1_Reasoning Matters for 3D Visual Grounding.pdf,Reasoning Matters for 3D Visual Grounding,"Hsiang-Wei Huang, Kuang-Ming Chen, Wenhao Chai, Cheng-Yen Yang, Jen-Hao Cheng, Jenq-Neng Hwang",,,"3D Visual Grounding, Large Language Models, Reasoning, Cross-modal Features, Data Synthesis, LLM Fine-tuning","This paper proposes a 3D visual grounding data pipeline that synthesizes data with reasoning processes, enabling the fine-tuning of a strong 3D visual grounding LLM, Reason3DVG-8B, which outperforms previous methods using significantly less training data.",17.01,Phi-4,AMD RX 6800 (Vulkan)
2601.08816v2_MemRec Collaborative Memory-Augmented Agentic Reco.pdf,MemRec: Collaborative Memory-Augmented Agentic Recommender System,"Weixin Chen, Yuhan Zhao, Jingyuan Huang, Zihe Ye, Clark Mingxuan Ju, Tong Zhao, Neil Shah, Li Chen, Yongfeng Zhang",,,"recommender systems, semantic memory, agentic systems, large language models, collaborative filtering, memory management","MemRec introduces a framework that decouples reasoning from memory management to enable efficient collaborative augmentation in agentic recommender systems, achieving state-of-the-art performance.",16.16,Phi-4,AMD RX 6800 (Vulkan)
2601.08828v1_Motion Attribution for Video Generation.pdf,Motion Attribution for Video Generation,"Xindi Wu, Despoina Paschalidou, Jun Gao, Antonio Torralba, Laura Leal-Taixé, Olga Russakovsky, Sanja Fidler, Jonathan Lorraine",,,"video generation, motion attribution, data curation, temporal dynamics, gradient-based framework, fine-tuning, temporal coherence, physical plausibility","Motive is a motion-centric framework for attributing motion in video generation models, enabling data curation to improve temporal consistency and physical plausibility.",16.94,Phi-4,AMD RX 6800 (Vulkan)
2601.08829v1_Modeling LLM Agent Reviewer Dynamics in Elo-Ranked.pdf,Modeling LLM Agent Reviewer Dynamics in Elo-Ranked Review System,"Hsiang-Wei Huang, Junbin Lu, Kuang-Ming Chen, Jenq-Neng Hwang",,,"Large Language Models, Elo-Ranked Review System, Reviewer Dynamics, Simulation, Peer Review","This work explores the dynamics of Large Language Model (LLM) agent reviewers in an Elo-ranked review system, highlighting improvements in decision accuracy and adaptive review strategies.",15.55,Phi-4,AMD RX 6800 (Vulkan)
2601.08873v1_ForensicFormer Hierarchical Multi-Scale Reasoning .pdf,ForensicFormer: Hierarchical Multi-Scale Reasoning for Cross-Domain Image Forgery Detection,"Hema Hariharan, Samson",,,"Image forensics, forgery detection, transformers, cross-domain generalization, AI-generated images, hierarchical reasoning","ForensicFormer is a hierarchical multi-scale framework that unifies low-level artifact detection, mid-level boundary analysis, and high-level semantic reasoning via cross-attention transformers, achieving significant improvements in cross-domain forgery detection accuracy.",15.97,Phi-4,AMD RX 6800 (Vulkan)
2601.08874v1_The Illusion of Friendship Why Generative AI Deman.pdf,The Illusion of Friendship: Why Generative AI Demands Unprecedented Ethical Vigilance,Md Zahidul Islam,,,"Generative AI, Ethical Vigilance, Friendship, Philosophical Argument, Moral Agency, Transformer-based AI, Anthropomorphic Cues","This paper explores the ethical risks of users forming emotional attachments to GenAI systems, arguing that while these systems may appear relationally persistent, they lack moral agency and should be used responsibly to avoid over-reliance and emotional misattribution.",16.89,Phi-4,AMD RX 6800 (Vulkan)
2601.08875v2_Learning Domain-Invariant Representations for Cros.pdf,Learning Domain-Invariant Representations for Cross-Domain Image Registration via Scene-Appearance Disentanglement,"Jiahao Qin, Yiwen Wang",,,"image registration, domain shift, scene-appearance disentanglement, cross-domain alignment, medical imaging, computer vision","This paper introduces SAR-Net, a framework for image registration under domain shift, by disentangling scene and appearance representations to enable consistent cross-domain alignment.",14.92,Phi-4,AMD RX 6800 (Vulkan)
2601.08881v1_TAG-MoE Task-Aware Gating for Unified Generative M.pdf,TAG-MoE: Task-Aware Gating for Unified Generative Mixture-of-Experts,"Yu Xu, Hongbin Yan, Juan Cao, Yiji Cheng, Tiankai Hang, Runze He, Zijin Yin, Shiyi Zhang, Yuxin Zhang, Jintao Li, Chunyu Wang, Qinglin Lu, Tong-Yee Lee, Fan Tang",,arXiv:2601.08881v1,"Mixture-of-Experts, Generative Models, Diffusion Transformers, Task-Aware Gating, Semantic Intent","This paper introduces TAG-MoE, a framework that injects semantic intent into MoE routing to mitigate task interference in unified image generation and editing models.",19.14,Phi-4,AMD RX 6800 (Vulkan)
2601.08882v1_Compressing Vision Transformers in Geospatial Tran.pdf,Compressing Vision Transformers in Geospatial Transfer Learning with Manifold-Constrained Optimization,"Thomas Snyder, H. Lexie Yang, Stefan Schnake, Steffen Schotthöfer",,arXiv:2601.08882v1,"vision transformers, geospatial transfer learning, manifold-constrained optimization, compression, remote sensing, foundation models","This work presents a method to compress large vision transformer-based geospatial foundation models using manifold-constrained optimization, achieving strong compression with minimal accuracy loss for on-device applications.",18.73,Phi-4,AMD RX 6800 (Vulkan)
2601.08884v1_Bridging the Gap Empowering Small Models in Reliab.pdf,Bridging the Gap: Empowering Small Models in Reliable OpenACC-based Parallelization via GEPA-Optimized Prompting,"Samyak Jhaveri, Cristina V. Lopes",,,"OpenACC, Parallel Code Generation, Large Language Models, Prompt Optimization, High-Performance Computing, GPU Programming","This work presents a systematic prompt optimization approach to enhance OpenACC pragma generation using the GEPA framework, significantly improving compilation success rates and GPU speedups for smaller LLMs.",16.0,Phi-4,AMD RX 6800 (Vulkan)
2601.08891v1_Attention Consistency Regularization for Interpret.pdf,Attention Consistency Regularization for Interpretable Early-Exit Neural Networks,Yanhua Zhao,,,"Early exit networks, explainable AI, attention mechanisms, multi-objective learning","This paper introduces Explanation-Guided Training (EGT), a framework that improves interpretability and consistency in early-exit networks through attention-based regularization, achieving competitive accuracy and enhanced attention consistency.",14.61,Phi-4,AMD RX 6800 (Vulkan)
2601.08892v1_Evaluating Role-Consistency in LLMs for Counselor .pdf,Evaluating Role-Consistency in LLMs for Counselor Training,"Eric Rudolph, Natalie Engert, Jens Albrecht",,arXiv:2601.08892v1,"Counseling, Chatbot, Large Language Model, Persona Consistency, Educational Role-Play",This paper introduces a new dataset with adversarial attacks to test large language models' role-consistency in virtual client interactions for counselor training.,17.6,Phi-4,AMD RX 6800 (Vulkan)
2601.08896v1_XGBoost Forecasting of NEPSE Index Log Returns wit.pdf,XGBoost Forecasting of NEPSE Index Log Returns with Walk Forward Validation,"Sahaj Raj Mallaa, Shreeyash Kayastha, Rumi Suwala, Harish Chandra Bhandaria, Rajendra Adhikari",,,"NEPSE Index, stock index forecasting, XGBoost, walk-forward validation, hyperparameter optimization, time series forecasting, emerging markets, feature engineering","This study develops a robust machine learning framework for one-step-ahead forecasting of daily log-returns in the Nepal Stock Exchange (NEPSE) Index using the XGBoost regressor, achieving superior predictive accuracy compared to traditional models.",17.11,Phi-4,AMD RX 6800 (Vulkan)
2601.08901v1_Navigating Ideation Space Decomposed Conceptual Re.pdf,Navigating Ideation Space: Decomposed Conceptual Representations for Positioning Scientific Ideas,"Yuexi Shen, Minqian Liu, Dawei Zhou, Lifu Huang",,,"scientific discovery, literature retrieval, conceptual representations, embedding approaches, novelty assessment","This paper introduces the Ideation Space, a structured representation that decomposes scientific knowledge into distinct dimensions to improve literature retrieval and novelty assessment, demonstrating substantial improvements over baseline methods.",14.99,Phi-4,AMD RX 6800 (Vulkan)
2601.08910v1_Towards a Self-Driving Trigger at the LHC Adaptive.pdf,Towards a Self-Driving Trigger at the LHC: Adaptive Response in Real Time,"Shaghayegh Emami, Cecilia Tosciri, Giovanna Salvi, Zixin Ding, Yuxin Chen, Abhijith Gandrakota, Christian Herwig, David W. Miller, Jennifer Ngadiuba, Nhan Tran",,arXiv:2601.08910v1,"physics.ins-det, real-time data filtering, self-driving trigger, Large Hadron Collider, machine learning, anomaly detection","This work explores a self-driving trigger framework for real-time data filtering at the LHC, optimizing signal efficiency and computational cost dynamically without manual retuning.",20.45,Phi-4,AMD RX 6800 (Vulkan)
2601.08950v1_ConvoLearn A Dataset of Constructivist Tutor-Stude.pdf,ConvoLearn: A Dataset of Constructivist Tutor-Student Dialogue,"Mayank Sharma, Roy Pea, Hari Subramonyam",,,"LLMs, pedagogical limitations, knowledge-building theory, dialogic learning, constructivist AI tutors, educational NLP, Socratic pedagogies","ConvoLearn introduces a dataset to address pedagogical limitations of LLMs by supporting dialogic learning through six core dimensions, demonstrating improved performance in knowledge-building strategies.",14.96,Phi-4,AMD RX 6800 (Vulkan)
2601.08951v1_PluriHarms Benchmarking the Full Spectrum of Human.pdf,PLURIHARMS: BENCHMARKING THE FULL SPECTRUM OF HUMAN JUDGMENTS ON AI HARM,"Jing-Jing Li, Joel Mire, Eve Fleisig, Valentina Pyatkin, Anne G. E. Collins, Maarten Sap, Sydney Levine",,,"AI safety, human judgments, harm benchmark, pluralistic AI, human values, disagreement analysis","PLURIHARMS is a benchmark designed to study human harm judgments on AI across dimensions of harm and agreement, revealing how diverse human values and traits influence perceived harmfulness and systematic disagreement.",17.53,Phi-4,AMD RX 6800 (Vulkan)
2601.08953v1_Fairness risk and its privacy-enabled solution in .pdf,Fairness risk and its privacy-enabled solution in AI-driven robotic applications,"Le Liu, Bangguo Yu, Nynke Vellinga, Ming Cao",,arXiv:2601.08953v1,"Robotic Decision-making, Large Language Model, Fairness, Privacy","This paper provides a utility-aware fairness metric for robotic decision-making, analyzing fairness jointly with user-data privacy, and tests a unified framework in a robot navigation task.",18.65,Phi-4,AMD RX 6800 (Vulkan)
2601.08955v1_Imagine-then-Plan Agent Learning from Adaptive Loo.pdf,Imagine-then-Plan: Agent Learning from Adaptive Lookahead with World Models,"Youwei Liu, Jian Wang, Hanlin Wang, Beichen Guo, Wenjie Li",,,"world models, agent learning, adaptive lookahead, multi-step trajectories, Markov decision process","We propose Imagine-then-Plan (ITP), a framework for agent learning via adaptive lookahead imagination, enhancing reasoning capabilities and task planning.",14.42,Phi-4,AMD RX 6800 (Vulkan)
2601.08988v1_ART Action-based Reasoning Task Benchmarking for M.pdf,Action-based Reasoning Task Benchmarking for Medical AI Agents,"Ananya Mantravadi, Shivali Dalmia, Abhishek Mukherji",,,"Medical AI agents, synthetic data generation, clinical reasoning evaluation, healthcare LLMs, benchmark, HITL","This paper introduces ART, a benchmark for evaluating medical AI agents on action-based reasoning tasks using real-world EHR data, highlighting gaps in aggregation and threshold reasoning.",15.84,Phi-4,AMD RX 6800 (Vulkan)
2601.09012v3_TranslateGemma Technical Report.pdf,TranslateGemma Technical Report,Google Translate Research Team,,,"machine translation, Gemma 3, fine-tuning, reinforcement learning, multilingual models, WMT25, WMT24++, multimodal capabilities","TranslateGemma is a suite of open machine translation models based on Gemma 3, enhanced through supervised fine-tuning and reinforcement learning, demonstrating improved translation quality and efficiency across multiple language pairs.",15.27,Phi-4,AMD RX 6800 (Vulkan)
2601.09018v1_Meta-learning to Address Data Shift in Time Series.pdf,META-LEARNING TO ADDRESS DATA SHIFT IN TIME SERIES CLASSIFICATION,"Samuel Myrenab, Nidhi Parikha, Natalie Kleina",,2601.09018v1,"signals, seismology, Reptile, FOMAML, model-agnostic meta-learning, domain generalization","This paper compares traditional deep learning with meta-learning algorithms to address data shift in time-series classification, introducing a seismic benchmark and finding meta-learning's advantages in data-scarce regimes.",16.1,Phi-4,AMD RX 6800 (Vulkan)
2601.09028v1_OpenDecoder Open Large Language Model Decoding to .pdf,OpenDecoder: Open Large Language Model Decoding to Incorporate Document Quality in RAG,"Fengran Mo, Zhan Su, Yuchen Hui, Jianhan Zhang, Jia Ao Sun, Zheyuan Liu, Chao Zhang, Tetsuya Sakai, Jian-Yun Nie",https://doi.org/10.1145/nnnnnnn.nnnnnnn,,"Information Retrieval, Retrieval-Augmented Generation, Robust Question Answer, Decoding Paradigm, Large Language Model","The paper proposes OpenDecoder, a new approach that leverages explicit evaluation of retrieved information as quality indicator features for generation, aiming to build a more robust RAG model.",17.36,Phi-4,AMD RX 6800 (Vulkan)
2601.09029v1_Proactively Detecting Threats A Novel Approach Usi.pdf,Proactively Detecting Threats: A Novel Approach Using LLMs,"Aniesh Chawla, Udbhav Prasad",,,"Malware, Indicators of Compromise, Cybersecurity, LLMs, GenAI, Machine Learning Algorithms, Deep Neural Network","This paper presents a systematic evaluation of large language models (LLMs) for proactively identifying indicators of compromise (IOCs) from unstructured web-based threat intelligence sources, highlighting significant performance variations among models.",15.41,Phi-4,AMD RX 6800 (Vulkan)
2601.09031v1_Generalizable Geometric Prior and Recurrent Spikin.pdf,Generalizable Geometric Prior and Recurrent Spiking Feature Learning for Humanoid Robot Manipulation,"Xuetao Li, Wenke Huang, Mang Ye, Jifeng Xuan, Bo Du, Sheng Liu, Miao Li",,,"Humanoid Robot Manipulation, Geometric Prior, Recurrent Spiking Feature Learning","This paper introduces RGMP-S, a novel framework for humanoid robot manipulation that combines high-level skill reasoning with data-efficient motion synthesis using geometric inductive biases and recursive spiking networks.",16.81,Phi-4,AMD RX 6800 (Vulkan)
2601.09032v1_The Hierarchy of Agentic Capabilities Evaluating F.pdf,The Hierarchy of Agentic Capabilities: Evaluating Frontier Models on Realistic RL Environments,"Logan Ritchie, Sushant Mehta, Nick Heiner, Mason Yu, Edwin Chen",,arXiv:2601.09032v1,"large language models, multi-step task completion, interactive environments, realistic RL environments, agentic capabilities, tool use, planning, goal formation, adaptability, groundedness, common-sense reasoning, task-centric design methodology, failure analysis, agent development","This study evaluates frontier AI models on 150 workplace tasks within a realistic e-commerce RL environment, revealing a hierarchy of agentic capabilities necessary for real-world deployment and highlighting substantial capability gaps before achieving human-level task completion.",19.05,Phi-4,AMD RX 6800 (Vulkan)
2601.09035v1_A Decompilation-Driven Framework for Malware Detec.pdf,A Decompilation-Driven Framework for Malware Detection with Large Language Models,"Aniesh Chawla, Udbhav Prasad",,arXiv:2601.09035v1,"Malware, Ghidra, Cybersecurity, LLMs, GenAI, Machine Learning Algorithms, LLMs Code development","This paper evaluates the efficacy of state-of-the-art Large Language Models (LLMs) in classifying executable code as benign or malicious, introducing an automated pipeline using Ghidra for decompilation and LLMs for classification.",17.07,Phi-4,AMD RX 6800 (Vulkan)
2601.09041v1_Can LLMs interpret figurative language as humans d.pdf,CANLLMS INTERPRET FIGURATIVE LANGUAGE AS HUMANS DO?: SURFACE-LEVEL VS. REPRESENTATIONAL SIMILARITY,"Samhita Bollepally, Aurora Sloman-Moll, Takashi Yamauchi",,,"Large Language Models, Figurative Language, Human Judgments, Pragmatic Inference, Sarcasm, Slang, Idioms, Contextual Cues","The study investigates how large language models (LLMs) align with human judgments in interpreting figurative and socially grounded language, finding that while LLMs align with humans at the surface level, they diverge significantly at the representational level, particularly with idioms and Gen Z slang.",17.07,Phi-4,AMD RX 6800 (Vulkan)
2601.09049v1_Is Grokking Worthwhile Functional Analysis and Tra.pdf,Is Grokking Worthwhile? Functional Analysis and Transferability of Generalization Circuits in Transformers,"Kaiyu He, Mian Zhang, Peilin Wu, Xinya Du, Zhiyu Zoey Chen",,,"Large Language Models, Transformers, Grokking, Generalization Circuit, Two-hop reasoning, Transferability","This study evaluates whether the grokking phase in parameter-sharing transformers, which forms a Generalization Circuit, enhances model performance on downstream tasks and justifies its computational cost.",15.41,Phi-4,AMD RX 6800 (Vulkan)
2601.09066v1_Midm 2.0 Korea-centric Bilingual Language Models.pdf,Mi:dm 2.0: Korea-centric Bilingual Language Models,"Tech. Innovation Group, KT",,arXiv:2601.09066v1,"Korea-centric AI, bilingual language models, Korean language processing, cultural alignment, large language models","Mi:dm 2.0 is a bilingual large language model engineered to advance Korea-centric AI, integrating Korean societal values and knowledge to generate culturally appropriate responses, with configurations for general and resource-constrained use.",16.22,Phi-4,AMD RX 6800 (Vulkan)
2601.09069v1_From Symbolic to Natural-Language Relations Rethin.pdf,From Symbolic to Natural-Language Relations: Rethinking Knowledge Graph Construction in the Era of Large Language Models,"Kanyao Han, Yushang Lai",,,"Knowledge Graphs, Symbolic Relations, Natural-Language Relations, Large Language Models, Knowledge Representation","This paper argues for transitioning from symbolic to natural-language relation descriptions in knowledge graphs, advocating for hybrid design principles that maintain a minimal structural backbone while allowing for more flexible and context-sensitive relational representations.",15.25,Phi-4,AMD RX 6800 (Vulkan)
2601.09072v1_Human-AI Co-design for Clinical Prediction Models.pdf,Human-AI Co-design for Clinical Prediction Models,"Jean Feng, Avni Kothari, Patrick Vossler, Andrew Bishara, Lucas Zier, Newton Addo, Aaron Kornblith, Yan Shuo Tan, Chandan Singh",,arXiv:2601.09072v1,"Large language models, Electronic health records, Concept Bottleneck, Human-AI Interaction",HACHI is an iterative human-in-the-loop framework that uses AI agents to accelerate the development of fully interpretable clinical prediction models by enabling the exploration of concepts in clinical notes.,17.12,Phi-4,AMD RX 6800 (Vulkan)
2601.09085v1_MMR-GRPO Accelerating GRPO-Style Training through .pdf,MMR-GRPO: Accelerating GRPO-Style Training through Diversity-Aware Reward Reweighting,"Kangda Wei, Ruihong Huang",,,"Group Relative Policy Optimization, GRPO, Maximal Marginal Relevance, mathematical reasoning, reinforcement learning, training efficiency","MMR-GRPO integrates Maximal Marginal Relevance to reweigh rewards based on completion diversity, reducing training steps and wall-clock time while maintaining peak performance in mathematical reasoning models.",14.1,Phi-4,AMD RX 6800 (Vulkan)
2601.09089v1_SubTokenTest A Practical Benchmark for Real-World .pdf,SUBTOKENTEST: A Practical Benchmark for Real-World Sub-token Understanding,"Shuyang Hou, Yi Hu, Muhan Zhang",,arXiv:2601.09089v1,"large language models, sub-token understanding, tokenization, benchmark, character-level tasks","SUBTOKENTEST is a benchmark assessing sub-token understanding in LLMs through practical tasks, highlighting tokenization-related failures and evaluating nine advanced LLMs.",15.14,Phi-4,AMD RX 6800 (Vulkan)
2601.09097v1_Programming over Thinking Efficient and Robust Mul.pdf,Programming over Thinking: Efficient and Robust Multi-Constraint Planning,"Derrick Goh Xin Deik, Quanyu Long, Zhengyuan Liu, Nancy F. Chen, Wenya Wang",,,"Multi-constraint planning, Large language models, Reasoning paradigms, Solver-based strategies, ScalableCOdePlanning Engine (SCOPE)","This paper introduces SCOPE, a framework that separates query-specific reasoning from generic code execution to address limitations in multi-constraint planning with large language models, achieving state-of-the-art performance with reduced cost and latency.",16.7,Phi-4,AMD RX 6800 (Vulkan)
