filename,title,authors,doi,arxiv_id,keywords,summary,tps,model,platform
2601.12402v1_Weaknesses of Facial Emotion Recognition Systems.pdf,Weaknesses of Facial Emotion Recognition Systems,"Aleksandra Jamróz, Patrycja Wysocka, Piotr Garbat",,2601.12402v1,"Facial Emotion Recognition, Deep learning, Computer Vision","This study reviews facial emotion recognition methods, highlighting weaknesses such as dataset differences and challenges in recognizing closely related emotions.",17.39,Phi-4,AMD RX 6800 (Vulkan)
2601.12405v1_Explainable Machine Learning for Pediatric Dental .pdf,Explainable Machine Learning for Pediatric Dental Risk Stratification Using Socio-Demographic Determinants,"Manasi Kanade, Abhi Thakkar, Gabriela Fernandes",,,"Explainable AI, Pediatric Dental Risk, Socio-Demographic Determinants, Machine Learning, SHAP, Risk Stratification","This study develops an explainable AI framework for pediatric dental risk stratification, emphasizing interpretability and ethical deployment, identifying socio-demographic factors as key contributors to dental risk.",18.67,Phi-4,AMD RX 6800 (Vulkan)
2601.12410v1_Are LLMs Smarter Than Chimpanzees An Evaluation on.pdf,Are LLMs Smarter Than Chimpanzees? An Evaluation on Perspective Taking and Knowledge State Estimation,"Dingyi Yang, Junqi Zhao, Xue Li, Ce Li, Boyang Li",,arXiv:2601.12410v1,"Large Language Models, Cognitive Anthropology, Theory of Mind, Knowledge State Estimation, Perspective Taking","This paper evaluates LLM performance in knowledge state tracking and estimation, revealing that current models perform near-randomly and are inferior to humans in understanding and predicting actions based on knowledge states.",16.06,Phi-4,AMD RX 6800 (Vulkan)
2601.12415v1_Orthogonalized Policy OptimizationDecoupling Sampl.pdf,Orthogonalized Policy Optimization: Decoupling Sampling Geometry from Optimization Geometry in RLHF,Wang Zixian,,arXiv:2601.12415v1,"RLHF, PPO, DPO, IPO, alignment methods, policy optimization, sampling geometry, optimization geometry, Bregman divergence, KL divergence, gradient dynamics","This work decouples sampling geometry from optimization geometry in RLHF, proposing Orthogonalized Policy Optimization (OPO) to address numerical instability and vanishing gradients in high-confidence regimes, providing a unifying perspective on existing alignment methods.",17.62,Phi-4,AMD RX 6800 (Vulkan)
2601.12436v1_Purification Before Fusion Toward Mask-Free Speech.pdf,PURIFICATION BEFORE FUSION: TOWARD MASK-FREE SPEECH ENHANCEMENT FOR ROBUST AUDIO-VISUAL SPEECH RECOGNITION,"Linzhi Wu, Xingyu Zhang, Hao Yuan, Yakun Zhang, Changyan Zheng, Liang Xie, Tiejun Liu, Erwei Yin",,,"audio-visual speech recognition, speech feature enhancement, noise-robust, multimodal bottleneck Conformer","This paper proposes an end-to-end noise-robust audio-visual speech recognition framework that eliminates the need for explicit noise mask generation, using a Conformer-based bottleneck fusion module to refine noisy audio features with video assistance, achieving robust recognition performance.",17.66,Phi-4,AMD RX 6800 (Vulkan)
2601.12442v1_Constraint-Aware Neurosymbolic Uncertainty Quantif.pdf,Constraint-Aware Neurosymbolic Uncertainty Quantification with Bayesian Deep Learning for Scientific Discovery,"Shahnawaz Alam, Mohammed Mudassir Uddin, Mohammed Kaif Pasha",,,"Neurosymbolic AI, Uncertainty Quantification, Bayesian Deep Learning, Scientific Constraints, Calibration, Physics-Informed Machine Learning","We introduce the Constraint-Aware Neurosymbolic Uncertainty Framework (CANUF), unifying Bayesian deep learning with differentiable symbolic reasoning to provide trustworthy uncertainty estimates while respecting domain constraints.",17.45,Phi-4,AMD RX 6800 (Vulkan)
2601.12443v1_Adversarial Defense in Vision-Language Models An O.pdf,Adversarial Defense in Vision-Language Models: An Overview,"Xiaowei Fu, Lei Zhang",,,"VLMs, adversarial defense, survey","This paper reviews adversarial defense strategies for Vision Language Models (VLMs), discussing the strengths and limitations of Training-time Defense, Test-time Adaptation Defense, and Training-free Defense in enhancing model robustness against adversarial attacks.",14.67,Phi-4,AMD RX 6800 (Vulkan)
2601.12444v1_Large Language Model for OWL Proofs.pdf,Large Language Model for OWL Proofs,"Hui Yang, Jiaoyan Chen, Uli Sattler",https://doi.org/10.1145/XXXXXX.XXXXXX,,"Computing methodologies, Description logics, Natural language generation","This work investigates the capacity of Large Language Models to generate proofs in the context of OWL ontologies, highlighting their potential and limitations in reasoning tasks under complex or imperfect conditions.",14.95,Phi-4,AMD RX 6800 (Vulkan)
2601.12449v1_AgenTRIM Tool Risk Mitigation for Agentic AI.pdf,AgenTRIM: Tool Risk Mitigation for Agentic AI,"Roy Betser, Shamik Bose, Amit Giloni, Chiara Picardi, Sindhu Padakandla, Roman Vainshtein",,,"AI agents, LLMs, tool permissions, security risks, tool-driven agency, AGENTRIM, least-privilege tool access, tool misuse, indirect prompt injection","AGeNTriM is a framework for detecting and mitigating tool-driven agency risks in AI agents, ensuring safer tool use without altering the agent's internal reasoning.",16.69,Phi-4,AMD RX 6800 (Vulkan)
2601.12465v1_Incentivizing In-depth Reasoning over Long Context.pdf,INCENTIVIZING IN-DEPTH REASONING OVER LONG CONTEXTS WITH PROCESS ADVANTAGE SHAPING,"Miao Peng, Weizhou Shen, Nuo Chen, Chenliang Li, Ming Yan, Jia Li",,,"Reinforcement Learning, Long-context Reasoning, KG-driven Synthesis, Process Advantage Shaping, Large Language Models","This paper addresses the degradation of Reinforcement Learning with Verifiable Rewards (RLVR) in long-context scenarios by proposing DEEPREASONQA and LONGPAS to enhance reasoning density and fine-grained credit assignment, outperforming RLVR baselines and matching frontier LLMs with fewer parameters.",17.4,Phi-4,AMD RX 6800 (Vulkan)
2601.12467v1_Patch-Level Tokenization with CNN Encoders and Att.pdf,Patch-Level Tokenization with CNN Encoders and Attention for Improved Transformer Time-Series Forecasting,Saurish Nagrath,,,"Multivariate time-series forecasting, financial time-series forecasting, Transformer models, temporal tokenization, convolutional neural networks, attention mechanisms, representation learning, deep learning for finance","This work proposes a two-stage forecasting framework using CNNs for local temporal representation learning and Transformers for global dependency modeling, achieving competitive performance in time-series forecasting.",16.33,Phi-4,AMD RX 6800 (Vulkan)
2601.12471v1_Knowing When to Abstain Medical LLMs Under Clinica.pdf,Knowing When to Abstain: Medical LLMs Under Clinical Uncertainty,"Sravanthi Machcha, Sushrita Yerra, Sahil Gupta, Aishwarya Sahoo, Sharmin Sultana, Hong Yu, Zonghai Yao",,,"Large Language Models, Medical Question Answering, Abstention, Conformal Prediction, Uncertainty, Safety-Critical Applications","This paper introduces MedAbstain, a benchmark for evaluating the ability of large language models to abstain when uncertain in medical multiple-choice question answering, highlighting the importance of abstention mechanisms for trustworthy deployment in high-stakes applications.",16.43,Phi-4,AMD RX 6800 (Vulkan)
2601.12494v1_Harmonizing the Arabic Audio Space with Data Sched.pdf,Harmonizing the Arabic Audio Space with Data Scheduling,"Hunzalah Hassan Bhatti, Firoj Alam, Shammur Absar Chowdhury",,,"Audio Large Language Models, Arabic-centric audio LLM, multi-task instruction tuning, speech summarization, dialect identification, emotion identification, Task-Progressive Curriculum, Aligner-Based Diverse Sampling, Omni-models, low-resource multimodal environments","This paper presents a systematic study of multi-task instruction tuning for an Arabic-centric audio LLM, introducing a novel dataset and strategies to balance efficiency and robustness in complex, low-resource settings.",16.22,Phi-4,AMD RX 6800 (Vulkan)
2601.12499v1_Failure Modes in Multi-Hop QA The Weakest Link Law.pdf,Failure Modes in Multi-Hop QA: The Weakest Link Law and the Recognition Bottleneck,"Meiru Zhang, Zaiqiao Meng, Nigel Collier",,,"Multi-Hop QA, Large Language Models, Position Bias, Attention Mechanisms, Multi-Focus Attention Instruction","This paper investigates the position bias in Large Language Models during multi-hop reasoning, introducing Multi-Focus Attention Instruction to address recognition and synthesis failures, and establishes the 'Weakest Link Law' where performance is determined by the least visible evidence.",15.03,Phi-4,AMD RX 6800 (Vulkan)
2601.12518v1_Cooperative Multi-agent RL with Communication Cons.pdf,Cooperative Multi-agent RL with Communication constraints,"Nuoya Xiong, Aarti Singh",,,"Multi-agent reinforcement learning, Communication constraints, Importance sampling, Base policy prediction, Nash equilibrium, Markov Cooperative Games","This paper proposes a technique called base policy prediction to address the instability of importance sampling in decentralized MARL systems with limited communication, enabling effective learning with fewer communication rounds.",14.66,Phi-4,AMD RX 6800 (Vulkan)
2601.12522v1_Improved Bug Localization with AI Agents Leveragin.pdf,Improved Bug Localization with AI Agents Leveraging Hypothesis and Dynamic Cognition,"Asif Mohammed Samir, Mohammad Masudur Rahman",https://doi.org/XXXXXXX.XXXXXXX,,"Bug Localization, LLM, Agentic AI, Cognition, Debugging, Software Engineering, Information Retrieval","This paper introduces CogniGent, a novel agentic technique for bug localization that leverages multiple AI agents for causal reasoning, call-graph-based root cause analysis, and context engineering, outperforming traditional and LLM-based techniques.",15.77,Phi-4,AMD RX 6800 (Vulkan)
2601.12534v1_Encoding Emotion Through Self-Supervised Eye Movem.pdf,ENCODING EMOTION THROUGH SELF-SUPERVISED EYE MOVEMENT RECONSTRUCTION,"Marcus Ma, Jordan Prescott, Emily Zhou, Tiantian Feng, Kleanthis Avramidis, Gabor Mihaly Toth, Shrikanth Narayanan",,,"eye movement, self-supervised learning, emotion prediction, deep learning","This study explores using self-supervised eye movement reconstruction to predict emotional expressions from low-resolution videos, demonstrating effective emotion prediction from naturalistic settings.",16.72,Phi-4,AMD RX 6800 (Vulkan)
2601.12535v1_Improving Low-Resource Machine Translation via Rou.pdf,Improving Low-Resource Machine Translation via Round-Trip Reinforcement Learning,"Ahmed Attia, Alham Fikri",,,"machine translation, low-resource, reinforcement learning, round-trip bootstrapping, NLLB models, BLEU, chrF++","This paper explores a self-supervised reinforcement-learning-based fine-tuning approach for low-resource machine translation using round-trip bootstrapping, showing improvements in fluency and semantic fidelity for several languages.",15.34,Phi-4,AMD RX 6800 (Vulkan)
2601.12538v1_Agentic Reasoning for Large Language Models.pdf,Agentic Reasoning for Large Language Models,"Tianxin Wei, Ting-Wei Li, Zhining Liu, Xuying Ning, Ze Yang, Jiaru Zou, Zhichen Zeng, Ruizhong Qiu, Xiao Lin, Dongqi Fu, Zihao Li, Mengting Ai, Duo Zhou, Wenxuan Bao, Yunzhe Li, Gaotang Li, Cheng Qian, Yu Wang, Xiangru Tang, Yin Xiao, Liri Fang, Hui Liu, Xianfeng Tang, Yuji Zhang, Chi Wang, Jiaxuan You, Heng Ji, Hanghang Tong, Jingrui He",,arXiv:2601.12538v1,"Agentic AI, LLM Agent, Agentic Reasoning, Self-evolving","This survey provides a systematic roadmap for agentic reasoning in large language models, organizing it along three dimensions: foundational, self-evolving, and collective multi-agent reasoning, and discusses its applications and challenges.",19.95,Phi-4,AMD RX 6800 (Vulkan)
2601.12539v1_MemeLens Multilingual Multitask VLMs for Memes.pdf,MemeLens: Multilingual Multitask VLMs for Memes,"Ali Ezzat Shahroor, Mohamed Bayan Kmainasi, Abul Hasnat, Dimitar Dimitrov, Giovanni Da San Martino, Preslav Nakov, Firoj Alam",,,"multilingual, multitask, vision language models, meme understanding, multimodal training, cross-domain generalization","MEMELENS is a unified multilingual and multitask explanation-enhanced Vision Language Model for meme understanding, addressing the limitations of task- and language-specific models by consolidating 38 public meme datasets into a shared taxonomy of 20 tasks.",17.22,Phi-4,AMD RX 6800 (Vulkan)
2601.12542v1_Rethinking the AI Scientist Interactive Multi-Agen.pdf,Rethinking the AI Scientist: Interactive Multi-Agent Workflows for Scientific Discovery,"Lukas Weidener, Marko Brkić, Mihailo Jovanović, Ritvik Singh, Chiara Baccin, Emre Ulgac, Alex Dobrin, Aakaash Meduri",,,"Artificial Intelligence, Scientific Discovery, Multi-Agent Systems, Interactive Workflows, Computational Biology, Novelty Detection","This paper introduces Deep Research, a multi-agent system enabling interactive scientific investigation with rapid turnaround times, demonstrating state-of-the-art performance in computational biology.",16.21,Phi-4,AMD RX 6800 (Vulkan)
2601.12547v1_How Clinicians Think and What AI Can Learn From It.pdf,"Ordinal-First, Robust Decision Algorithms for Medicine","Dr. Dipayan Sengupta, MD (Dermatology), Dr. Saumya Panda, MD (Dermatology)",,arXiv:2601.12547v1,"clinical artificial intelligence, decision-making, ordinal non-compensatory algorithms, robust decision algorithms, medicine, lexicographic heuristics, ϵ-dominance, maximin, minimax regret","This paper argues that clinical AI should focus on robust decision-making using ordinal non-compensatory algorithms, as real clinical reasoning involves sequential, time-bounded decisions under uncertainty, often guided by heuristics and patient values.",17.89,Phi-4,AMD RX 6800 (Vulkan)
2601.12549v1_Benchmarking Concept-Spilling Across Languages in .pdf,Benchmarking Concept-Spilling Across Languages in LLMs,"Ilia Badanin, Daniil Dzenhaliou, Imanol Schlag",,arXiv:2601.12549v1,"Multilingual Large Language Models, semantic robustness, polysemous words, language spilling, semantic interference, meaning generation task, linguistic balance","This paper introduces a framework for evaluating multilingual semantic robustness in LLMs by measuring how models handle polysemous words across languages, revealing significant variation in semantic robustness and providing tools for developing more balanced AI systems.",17.88,Phi-4,AMD RX 6800 (Vulkan)
2601.12554v1_Artificial Intelligence in Materials Science and E.pdf,"Artificial Intelligence in Materials Science and Engineering: Current Landscape, Key Challenges, and Future Trajectories","Iman Peivaste, Salim Belouettar, Francesco Mercuri, Nicholas Fantuzzi, Hamidreza Dehghani, Razieh Izadi, Halliru Ibrahim, Jakub Lengiewicz, Maël Belouettar-Mathis, Kouider Bendine, Ahmed Makradi, Martin Hörsch, Peter Klein, Mohamed El Hachemi, Heinz A. Preisig, Yacine Rezgui, Natalia Konchakova, Ali Daouadji",,2601.12554v1,"Artificial Intelligence, Materials Science, Machine Learning, Deep Learning, Generative AI, Probabilistic Models, Data Representation, Featurization","Artificial Intelligence is rapidly transforming materials science and engineering, offering powerful tools to navigate complexity, accelerate discovery, and optimize material design in ways previously unattainable.",19.78,Phi-4,AMD RX 6800 (Vulkan)
2601.12557v1_Life Machine Learning and the Search for Habitabil.pdf,"Life, Machine Learning, and the Search for Habitability: Predicting Biosignature Fluxes for the Habitable Worlds Observatory","Mark Moussa, Amber V. Young, Brianna Isola, Vasuda Trehan, Michael D. Himes, Nicholas Wogan, Giada Arney",,,"machine learning, biosignature, exoplanets, direct-imaging, Habitable Worlds Observatory, Bayesian Convolutional Neural Network, Spectral Query Adaptive Transformer","This paper introduces two machine-learning models for predicting biosignature species fluxes from exoplanetary spectra, aimed at optimizing observation schedules for missions like NASA's Habitable Worlds Observatory.",17.41,Phi-4,AMD RX 6800 (Vulkan)
2601.12560v1_Agentic Artificial Intelligence AI Architectures T.pdf,"Agentic Artificial Intelligence (AI): Architectures, Taxonomies, and Evaluation of Large Language Model Agents","Arunkumar V, Gangadharan G.R., Rajkumar Buyya",,arXiv:2601.12560v1,"Agentic AI, Large Language Models, Autonomous Agents, Multi-Agent Systems, Cognitive Architectures, Tool Use, Planning","This paper investigates architectures and proposes a unified taxonomy for Agentic AI, describing the transition from linear reasoning to native inference models and from fixed API calls to open standards, while addressing challenges like hallucination in action and prompt injection.",18.15,Phi-4,AMD RX 6800 (Vulkan)
2601.12577v1_Primate-like perceptual decision making emerges th.pdf,Primate-like perceptual decision making emerges through deep recurrent reinforcement learning,"Nathan J. Wispinski, Scott A. Stone, Anthony Singhal, Patrick M. Pilarski, Craig S. Chapman",,2601.12577v1,"decision making, neural mechanisms, reinforcement learning, deep recurrent neural networks, primate, evidence accumulation, behavioral abilities","The study demonstrates that primate-like decision-making abilities, such as trading off speed for accuracy and changing decisions based on new information, can be learned by deep recurrent neural networks through reinforcement learning, supporting theories about the evolution of these mechanisms.",17.83,Phi-4,AMD RX 6800 (Vulkan)
2601.12582v1_Ontology-aligned structuring and reuse of multimod.pdf,Ontology-aligned structuring and reuse of multimodal materials data and workflows towards automatic reproduction,"Sepideh Baghaee Ravari, Abril Azocar Guzman, Sarath Menon, Stefan Sandfeld, Tilmann Hickel, Markus Stricker",,,"text mining, workflow, large language models, stacking fault energy","An ontology-driven, large language model-assisted framework is introduced for the automated extraction and structuring of computational workflows from the literature, focusing on density functional theory-based stacking fault energy calculations in magnesium and its alloys.",17.22,Phi-4,AMD RX 6800 (Vulkan)
2601.12585v1_Do MLLMs See What We See Analyzing Visualization L.pdf,Analyzing Visualization Literacy Barriers in AI Systems,"Mengli (Dawn) Duan, Yuhe (Sissi) Jiang, Matthew Varona, Carolina Nobre",xx.xxxx/TVCG.201x,,"Visualization Literacy, Multimodal Large Language Model, Evaluation Study","This paper presents a systematic analysis of barriers to visualization literacy in Multimodal Large Language Models (MLLMs), revealing machine-specific barriers and performance issues with complex visualizations.",15.89,Phi-4,AMD RX 6800 (Vulkan)
2601.12594v1_SLAP Scalable Language-Audio Pretraining with Vari.pdf,SLAP: SCALABLE LANGUAGE-AUDIO PRETRAINING WITH VARIABLE-DURATION AUDIO AND MULTI-OBJECTIVE TRAINING,"Xinhao Mei, Gael Le Lan, Haohe Liu, Zhaoheng Ni, V arun Nagaraja, Yang Liu, Yangyang Shi, Vikas Chandra",,,"Multimodal learning, CLAP, self-supervised learning, contrastive learning, multi-objective learning","SLAP introduces scalable language-audio pretraining with 109 million audio-text pairs of variable durations, incorporating multiple training objectives to achieve state-of-the-art performance in audio-text retrieval and zero-shot audio classification.",17.69,Phi-4,AMD RX 6800 (Vulkan)
2601.12607v1_A Cloud-based Multi-Agentic Workflow for Science.pdf,A Cloud-based Multi-Agentic Workflow for Science,"Anurag Acharya, Timothy Vega, Rizwan A. Ashraf, Anshu Sharma, Derek Parker, Robert Rallo",10.1145/nnnnnnn.nnnnnnn,,"Large Language Models, LLMs for Science, LLM Agents, Multi-agent Framework, Catalysis, Chemistry, Material Science, Cloud Computing","This paper presents a domain-agnostic, model-independent workflow for an agentic framework that can act as a scientific assistant while being run entirely on the cloud, demonstrating its utility in tasks like literature review, data analysis, and simulation runs.",17.1,Phi-4,AMD RX 6800 (Vulkan)
2601.12617v1_Creating Disability Story Videos with Generative A.pdf,"Creating Disability Story Videos with Generative AI: Motivation, Expression, and Sharing","Shuo Niu, Dylan Clements, Hyungsin Kim",10.1145/3772318.3791495,,"Disability, Storytelling, Video, Generative AI, LLM","This research examines how people with disabilities use Generative AI to create videos sharing their experiences, highlighting the affordances and challenges of GenAI in supporting disability storytelling.",14.85,Phi-4,AMD RX 6800 (Vulkan)
2601.12637v1_Topology-Aware Multiscale Mixture of Experts for E.pdf,Topology-Aware Multiscale Mixture of Experts for Efficient Molecular Property Prediction,"Long D. Nguyen, Kelin Xia, Binh P. Nguyen",,arXiv:2601.12637v1,"Graph Neural Networks, Topological Deep Learning, Mixture of Experts, Molecular Representation","We propose Multiscale Interaction Mixture of Experts (MI-MoE) to adapt interaction modeling across geometric regimes, improving 3D molecular graph learning.",16.3,Phi-4,AMD RX 6800 (Vulkan)
2601.12638v1_Mixed Precision PointPillars for Efficient 3D Obje.pdf,Mixed Precision PointPillars for Efficient 3D Object Detection with TensorRT,"Ninnart Fuengfusin, Keisuke Yoneda, Naoki Suganuma",,,"neural networks, quantization, 3D object detection","This paper proposes a mixed precision framework for PointPillars to address performance degradation in LIDAR 3D object detection due to model quantization, achieving reduced latency and model size with TensorRT deployment.",15.7,Phi-4,AMD RX 6800 (Vulkan)
2601.12641v1_STEP-LLM Generating CAD STEP Models from Natural L.pdf,STEP-LLM: Generating CAD STEP Models from Natural Language with Large Language Models,"Xiangyu Shi, Junyang Ding, Xu Zhao, Sinong Zhan, Payal Mohapatra, Daniel Quispe, Kojo Welbeck, Jian Cao, Wei Chen, Ping Guo, Qi Zhu",,arXiv:2601.12641v1,"Computer-aided design, STEP file, large language models, design automation","This paper introduces a framework for generating CAD STEP models from natural language using large language models, demonstrating improved geometric fidelity over existing methods.",17.64,Phi-4,AMD RX 6800 (Vulkan)
2601.12646v1_Unbounded Harms Bounded Law Liability in the Age o.pdf,"Unbounded Harms, Bounded Law: Liability in the Age of Borderless AI",Ha-Chi Tran,,arXiv:2601.12646v1,"artificial intelligence, risk governance, liability, transboundary harms, legal frameworks, compensation mechanisms",The paper discusses the inadequacies of current legal frameworks in addressing transboundary AI harms and proposes a global AI compensation and accountability architecture.,15.83,Phi-4,AMD RX 6800 (Vulkan)
2601.12648v1_Intelligent Documentation in Medical Education Can.pdf,Intelligent Documentation in Medical Education: Can AI Replace Manual Case Logging?,"Nafiz Imtiaz Khan, MSc, Kylie Cleland, BSc, Vladimir Filkov, PhD, Roger Eric Goldman, PhD",,,"artificial intelligence, large language models, radiology, case logs, medical education","This study investigates the feasibility of using large language models to automate procedural case log documentation in radiology training, evaluating AI's potential to replace manual logging and its integration into clinical workflows.",16.14,Phi-4,AMD RX 6800 (Vulkan)
2601.12654v1_Explanation Multiplicity in SHAP Characterization .pdf,Explanation Multiplicity in SHAP: Characterization and Assessment,"Hyunseung Hwang, Seungeun Lee, Lucas Rosenblatt, Julia Stoyanovich, Steven Euijong Whang",https://doi.org/XXXXXXX.XXXXXXX,,"SHAP, Explainable AI, Post-hoc explanations, Feature attribution, Explanation multiplicity","This paper investigates the phenomenon of explanation multiplicity in SHAP, highlighting how explanations can vary across runs and proposing methods to characterize and assess this instability.",16.64,Phi-4,AMD RX 6800 (Vulkan)
2601.12658v1_Augmenting Question Answering with A Hybrid RAG Ap.pdf,Augmenting Question Answering with A Hybrid RAG Approach,"Tianyi Yang, Nashrah Haque, Vaishnave Jonnalagadda, Yuya Jeremy Ong, Zhehui Chen, Yanzhao Wu, Lei Yu, Divyesh Jadav, Wenqi Wei",,,"Question-answering, RAG, query processing, Large Language Models, natural language processing, retrieval-augmented generation, vector and graph based techniques, context unification","This paper introduces Structured-Semantic RAG (SSRAG), a hybrid architecture that enhances QA quality by integrating query augmentation, agentic routing, and a structured retrieval mechanism, improving answer accuracy and informativeness across multiple QA datasets.",18.05,Phi-4,AMD RX 6800 (Vulkan)
2601.12661v1_MedConsultBench A Full-Cycle Fine-Grained Process-.pdf,"MedConsultBench: A Full-Cycle, Fine-Grained, Process-Aware Benchmark for Medical Consultation Agents","Chuhan Qiao, Jianghua Huang, Daxing Zhao, Ziding Liu, Yanjun Shen, Bing Cheng, Wei Lin, Kai Wu",,arXiv:2601.12661v1,"medical consultation agents, dynamic benchmarks, clinical workflow, information acquisition, diagnostic accuracy, medication safety, large language models","MedConsultBench evaluates the complete online consultation cycle, addressing the gap between theoretical medical knowledge and clinical practice by introducing fine-grained metrics and focusing on information-gathering efficiency and medication safety.",17.82,Phi-4,AMD RX 6800 (Vulkan)
